title,score,subreddit,url,num_comments
"TIL about Whipping Tom of 1681, a nickname given to a serial spanker in London. He would wait for an unaccompanied woman, grab her, lift her dress and slap her buttocks whiles shouting ""Spanko!"" before fleeing. Vigilantes would dress in women's clothing and patrol the areas he was known to operate.",10749,todayilearned,https://en.wikipedia.org/wiki/Whipping_Tom?wprov=sfla1,423
"My girlfriend, attempting to use Siri to add olive oil to our shopping list",20353,funny,https://i.imgur.com/ByLe23S.jpg,452
Big brother stepped up,14308,AnimalsBeingBros,https://v.redd.it/oj59a88yv3wa1,135
"When the CEO of Mercedes retired, BMW did this",11088,Unexpected,https://v.redd.it/mnnb6nc454wa1,216
me_irlgbt,16360,me_irlgbt,https://i.redd.it/rq3usjo014wa1.jpg,229
Clever boy,11753,aww,https://v.redd.it/p3lz1641d2wa1,71
"‘MAGA movement’ widely unpopular, new poll finds",15058,politics,https://www.nbcnews.com/meet-the-press/meetthepressblog/maga-movement-widely-unpopular-new-poll-finds-rcna81200,1067
He changed the Rubix cube rules.,9015,nextfuckinglevel,https://v.redd.it/z5pbhy3ym2wa1,281
High Quality Anvil,5585,Damnthatsinteresting,https://v.redd.it/52x7rqtr23wa1,274
Golden retrievers aren't the smartest boys but they are some of the best boys,9287,Eyebleach,https://i.imgur.com/w0GINxb.gifv,107
"Favorite Carlson quote (so far): “We’re all pretending we’ve got a lot to show for it, because admitting what a disaster it’s been is too tough to digest. But come on. There really isn’t an upside to Trump.”",10108,LeopardsAteMyFace,https://www.theguardian.com/media/2023/apr/25/tucker-carlson-leaves-fox-news-dominion-lawsuit,408
"If you take the low road, you're not a victim when they meet you there [not oc]",11840,Wellthatsucks,https://v.redd.it/xylbel7752wa1,1271
"In 2020, I lost my job due to covid, my TV exploded and all I had to game was using a PS VITA Shareplay with my PS4. Sold both of them the same year to make ends meet. Now i got my life together again and decided to do a comparison",67223,gaming,https://i.redd.it/ll5pmgixb3wa1.jpg,1506
She better get a raise,61015,wholesomememes,https://i.redd.it/gsn1tsad13wa1.jpg,315
Brooklyn librarians subverting censorship & allowing any teenager in America to have a library card.,13491,gatesopencomeonin,https://i.redd.it/2a9ynxhzexva1.jpg,176
Gravestone of George Johnson who was unjustly hanged in Arizona.,42829,pics,https://i.redd.it/ox5ze0st03wa1.jpg,1188
Using an excavator to help an elephant ,39441,interestingasfuck,https://v.redd.it/1lw0n88mi1wa1,1079
Customer states ABS/ESC and front radar lights on…,12406,Justrolledintotheshop,https://i.redd.it/vdbmektsa3wa1.jpg,445
In todays issue of captain obvious magazine,46832,WhitePeopleTwitter,https://i.redd.it/6c52jihww2wa1.jpg,873
When the Universe has other plans for you😂,23958,ContagiousLaughter,https://v.redd.it/epg10mli33wa1,1081
xQc why you sitting like that?,39417,memes,https://i.redd.it/z4zy2tij13wa1.jpg,842
"Harry Belafonte, singer, actor and tireless activist, dies aged 96",21774,news,https://www.theguardian.com/music/2023/apr/25/harry-belafonte-singer-dies-actor-singer-activist,522
Whose fault is it really? ¯\_(ツ)_/¯,13180,BlackPeopleTwitter,https://i.redd.it/qt92hyw753wa1.jpg,355
My ice cream was solid ice on the inside,16110,mildlyinteresting,https://i.redd.it/2eo0d0yd03wa1.jpg,483
To hang glide,10414,therewasanattempt,https://v.redd.it/9jgwv6fnd3wa1,412
"School for 'troubled teens' denied life-saving treatment for a girl, claiming she was ""faking it"". She had peritonitis and would later die of sepsis & organ failure. The school prevented the girl from calling her parents in the weeks leading up to her death.",23151,iamatotalpieceofshit,https://i.redd.it/1oegprwi71wa1.png,757
Madlad highlights hidden NY gems on Google.,7605,madlads,https://i.redd.it/y386zhlin3wa1.jpg,198
Rare cloud formations spotted over New Hampshire,7286,oddlysatisfying,https://www.reddit.com/gallery/12yofq0,191
"[OC] I spent the past two years pouring my soul into a website that allows you to visualize virtually every U.S. company's international supply chain. E.x. What products, how much, which factories and where does GameStop import from? (Just type a company in the search box)",12066,dataisbeautiful,https://www.importyeti.com/company/gamestop,437
meirl,13061,meirl,https://i.redd.it/pjt4420um1wa1.jpg,963
I ordered a terracotta pot from Ikea,7501,mildlyinfuriating,https://i.redd.it/rwajb1ukk3wa1.jpg,738
New Image from 'Chicken Run: Dawn of the Nugget',21070,movies,https://i.redd.it/wl5dduw641wa1.jpg,701
People helped to rebuild owner's garden that were destroyed by vandals,40705,HumansBeingBros,https://v.redd.it/71hoy1txz0wa1,844
He has his human well trained,13565,cats,https://v.redd.it/s50vrlddt2wa1,118
1920s coming back in 2023.,13741,dndmemes,https://i.redd.it/t074q1eid1wa1.png,353
[Moriendel] [Emperor's New Groove] Yzma: I want that Twink Obiliterated.,5083,tumblr,https://i.redd.it/51mm843xh2wa1.png,33
Sex 🤤,19861,shitposting,https://v.redd.it/m98lqajcw2wa1,239
Battle rapper gets punched for saying the N word.,12662,PublicFreakout,https://v.redd.it/vsawj7jae1wa1,1954
"Interesting theory, thoughts? 🤔",9919,antiwork,https://i.redd.it/fl4icu47i1wa1.jpg,311
Who is the real Thief?,22391,WorkReform,https://i.redd.it/5qw017khz0wa1.png,291
"Charles Barkley on Jimmy Butler’s 56 point performance: “That was the best performance I’ve seen since I’ve been on television. It was flat out incredible, it was a honor and privilege to watch it, but man, that guy was not gonna let them lose tonight.”",9501,nba,https://streamable.com/7epjdc,615
I keep trying to watch The Day The Earth Froze (1959) but these three guys in the front row won't pipe down.,8884,shittymoviedetails,https://i.redd.it/lr7nc3ks43wa1.jpg,113
This is so cute,5128,MadeMeSmile,https://i.redd.it/g0ecxe84s3wa1.jpg,47
"Lovebirds of Reddit, how did you get over ""the one that got away?"" Did you ever see them again?",4132,AskReddit,https://www.reddit.com/r/AskReddit/comments/12yqv1p/lovebirds_of_reddit_how_did_you_get_over_the_one/,1364
Fortune cookie,8207,oddlyterrifying,https://i.redd.it/zpsshqa493wa1.jpg,99
"Sorry, we're on break",5199,WTF,https://i.redd.it/evo3xp4ua2wa1.jpg,372
Blursed swimming pool,10660,blursedimages,https://i.redd.it/js5zatw623wa1.jpg,304
Messi look confused,4196,blackmagicfuckery,https://v.redd.it/2fwukblzi2wa1,101
RiNg CaMeRa CaTcHeS dEliVeRy DrIvEr AbUsInG dOg,48254,PeopleFuckingDying,https://v.redd.it/g58cji7rb2wa1,633
Cannabis company offers jobs to all 400+ Burger King workers laid off in Michigan,24981,nottheonion,https://www.metrotimes.com/weed/cannabis-company-offers-jobs-to-all-400-burger-king-workers-laid-off-in-michigan-32950714?media=AMP+HTML,772
"That's bad, right?",8963,DeepRockGalactic,https://i.redd.it/f26uhpoii1wa1.jpg,177
SLPT: Get the warmest food at your local convenience store!,6008,ShittyLifeProTips,https://i.imgur.com/On0cDTV.jpg,47
Don't get burned on your way out.,4252,rareinsults,https://i.redd.it/fubu8r4nf2wa1.png,88
"Not accusing anyone of anything, but people have a right to know the truth! /s",12353,PoliticalHumor,https://i.redd.it/gwygu0egk2wa1.jpg,253
me_irl,15605,me_irl,https://i.redd.it/6uoby2mg01wa1.jpg,168
"I modeled, printed, and painted this little house to express my frustration with the housing market",7071,3Dprinting,https://i.redd.it/dmp3ilgcl1wa1.png,230
🔥This male adult Elephant in Sri Lanka was the first scientific record of dwarfism in the wild. He measures at just over 1.5 meters (five feet) in height,6786,NatureIsFuckingLit,https://i.redd.it/01kr6lit63wa1.jpg,149
Children of the Bourne,26078,BrandNewSentence,https://i.redd.it/n1tnlnsd62wa1.jpg,159
"Thanks, I Hate Ninja Turtles",5954,TIHI,https://i.redd.it/4mgm3e5hx1wa1.jpg,89
"A gene in the brain driving anxiety symptoms has been identified, modification of the gene is shown to reduce anxiety levels, offering an exciting novel drug target for anxiety disorders",14354,science,https://www.bristol.ac.uk/news/2023/april/gene-brainstudy.html,758
Good for them,20483,NonPoliticalTwitter,https://i.redd.it/jts85umj52wa1.jpg,160
She was giving him the eyes afterwards,10547,dankmemes,https://i.redd.it/y0tnph30h1wa1.gif,139
"Rick Ross has offered Don Lemon a job at Wingstop after he was fired from CNN: 'I'mma make sure I get you in front of the right grill, brother'",5713,entertainment,https://www.insider.com/rick-ross-offers-don-lemon-job-wingstop-after-cnn-firing-2023-4,337
take a seat,11770,PrequelMemes,https://i.redd.it/dk2ur0b761wa1.jpg,62
"Harry Belafonte, 96, Dies; Barrier-Breaking Singer, Actor and Activist",8050,Music,https://www.nytimes.com/2023/04/25/arts/music/harry-belafonte-dead.html?unlocked_article_code=bgNMjVdwNFD_9qdAy3kvBzj7FkdTvCmx8x8h_j1QqxbmIYmcpbgS-VWMpelKrY9dNZYhv0mw2X1Y-Rw4StX_i-0wi6U3teT5GrJLFGhCbmmLOIg2paYO_QtPx0iqjLDhW0aOchpVo2iv9OOuraFadbd9N_GOzkGA8zkIEc3XVYHXky4T88ze9pkBhECib1k-TzhUm16dp1Z5j8atfdjXVrgRYFBHLaWgFDqR_eVm6JLiiRjO8deQcNEivcFPUu6joMNIYuawZMyeIafuSvet59W37P_SSS7hgaEMFoucTbDJc3W-Qlfc95LESfmSGkpDnuVKK4W_M3PKUaX_SVhwP_g,275
TIFU by not wearing underwear.,4164,tifu,https://www.reddit.com/r/tifu/comments/12yorx1/tifu_by_not_wearing_underwear/,613
"China doesn’t want peace in Ukraine, Czech president warns",23085,worldnews,https://www.politico.eu/article/trust-china-ukraine-czech-republic-petr-pavel-nato-defense/,1212
What!? Huh!?,4604,Gamingcirclejerk,https://i.redd.it/x7nzn9n2j3wa1.jpg,216
"""The Name's Bond... James Bond""",8913,technicallythetruth,https://i.redd.it/1ej82hpfe1wa1.png,90
Two sides of people not being able to upgrade to Windows 11,40606,pcmasterrace,https://i.redd.it/lzgxuqutf0wa1.jpg,2419
I love how these 4 literally save all of Middle-Earth and have everyone in Gondor bow down to them and yet no matter what they do they'll just never get the approval of this one old guy from The Shire lol,10069,lotrmemes,https://v.redd.it/m3g6b18e11wa1,285
"Clay sculpting, truly amazing skills.",25807,nextfuckinglevel,https://v.redd.it/tuq260y7v2wa1,362
You telling me you don't need to use this minecart for that korok?,4331,Breath_of_the_Wild,https://v.redd.it/thb0qc1v12wa1,221
Cast Iron Maintenance 101 (OC),6551,comics,https://i.redd.it/jpvzubnow2wa1.jpg,156
I don’t even know what to put here,6641,trashy,https://i.redd.it/o09bzo3gw2wa1.jpg,217
He’s probably right,5358,clevercomebacks,https://i.redd.it/hxbf59xs53wa1.jpg,84
ELI5: Why flathead screws haven't been completely phased out or replaced by Philips head screws,4787,explainlikeimfive,https://www.reddit.com/r/explainlikeimfive/comments/12ymhbo/eli5_why_flathead_screws_havent_been_completely/,1272
Texas Agency Threatens to Fire People Who Don’t Dress ‘Consistent With Their Biological Gender’,20889,politics,https://www.vice.com/en/article/n7ebag/texas-ag-transgender-dress-code-memo,2235
Single cell grows and becomes a  Salamander,7273,Damnthatsinteresting,https://v.redd.it/jk5fzw6q82wa1,540
"Oh shit, my trans friend is broke, guess she monke now :(",3727,CuratedTumblr,https://i.redd.it/jq6wetod62wa1.png,149
The EU Suppressed a 300-Page Study That Found Piracy Doesn’t Harm Sales,15733,Piracy,https://gizmodo.com/the-eu-suppressed-a-300-page-study-that-found-piracy-do-1818629537,559
It does make life easier,7460,ProgrammerHumor,https://i.redd.it/rmef9hfjp2wa1.jpg,346
"Russian Gay Pride protest in St. Petersburg, 2018",17912,fakehistoryporn,https://i.redd.it/ul7cz6co02wa1.jpg,402
the 2023 grid but the teams are based solely on their driver photos,5921,formuladank,https://www.reddit.com/gallery/12ykwhj,94
[she/her] before and after the vaccine (I've taken large amounts of estrogen),9163,lgbt,https://i.redd.it/0s79ob26j2wa1.jpg,258
"Don’t work hard, work smaart",11253,meme,https://i.redd.it/6amqxkxvg2wa1.gif,119
2meirl4meirl,2933,2meirl4meirl,https://i.redd.it/jhqz2goyh2wa1.jpg,40
"If soloing a dungeon is too difficult, you shouldnt be Guardian rank 11.",3542,DestinyTheGame,https://www.reddit.com/r/DestinyTheGame/comments/12yosth/if_soloing_a_dungeon_is_too_difficult_you/,1299
Can I join please?,14540,fixedbytheduet,https://v.redd.it/9x2r7i2u22wa1,379
Front Bottoms,2891,TikTokCringe,https://v.redd.it/cd008us9h2wa1,229
Anddd it’s halted,3223,wallstreetbets,https://i.redd.it/7g7dcsrgu3wa1.jpg,686
"Since spaceships aren’t available to everyone yet, the golden age of piracy hasn’t happened",15968,Showerthoughts,https://www.reddit.com/r/Showerthoughts/comments/12yg5kc/since_spaceships_arent_available_to_everyone_yet/,689
Absolute unit of a wiggly boy,4368,AbsoluteUnits,https://v.redd.it/55x5y04qt1wa1,211
The wrong people have money,2446,facepalm,https://i.redd.it/jt6sb7adr2wa1.jpg,99
"Borrow rate spike on Ortex was not a ""glitch"". Questrade's (canadian broker) borrow rate over 180% this morning... Was around 7-8% in the last few days. Something going on underneath these ""fair markets"" hoods?",4890,Superstonk,https://i.redd.it/004nwbq5f3wa1.png,227
Name that anime,3876,Animemes,https://i.redd.it/7ilbzzzej3wa1.jpg,346
Based Nurse,10608,wholesomememes,https://i.redd.it/xymmolv3v1wa1.jpg,173
A summary of about half the fanart posted (without credit) to this sub.,8081,OnePunchMan,https://i.redd.it/fa32nm8z21wa1.jpg,204
Revere Beach Massachusetts 1980s,5695,OldSchoolCool,https://i.redd.it/2j7r5z6lu2wa1.jpg,465
"I have spent 3 years and over 6,000 hours working on this project so far. It is a 3D virtual tabletop that lets you play D&D online through Steam with your friends. It's FREE to download and give it a try if you are interested. I would love any feedback you might have! More info in comments. [OC]",9166,DnD,https://v.redd.it/j569nsrlp0wa1,506
TSA airport screeners are getting a raise to almost $60K plus benefits,10173,news,https://www.timesunion.com/business/article/TSA-airport-screeners-are-getting-a-raise-to-17725546.php,1246
My baby boy from five days old to three months old,6593,rarepuppers,https://www.reddit.com/gallery/12yj7vc,99
Sometimes I think we are very lucky GW is just greedy and not outright evil,3989,Grimdank,https://i.redd.it/xn0i5dubw1wa1.jpg,277
"Guy wrote a message: "" Hi, I am a muslim, they call us terrorist. If You trust me, hug me!""",3690,wholesome,https://v.redd.it/l42jjd1j02wa1,104
What the fu-,11282,interestingasfuck,https://i.redd.it/kcd9w2ren1wa1.jpg,589
I’m going to die alone ,7582,discordVideos,https://v.redd.it/fhpjqerer2wa1,120
Man In Wheelchair doing pullups,4904,BeAmazed,https://v.redd.it/olesdrebk1wa1,378
Evander Kane's Instagram Story regarding young Oilers fan's experience in LA,4328,hockey,https://i.redd.it/mwa7c9izm1wa1.jpg,1090
Empty wrapping paper rolls throughout the ages,2702,trippinthroughtime,https://i.imgur.com/xxVOh8L.jpg,18
How secure are gated communities?,84359,Unexpected,https://v.redd.it/cbynh3zse2wa1,2000
Just Katara,2995,TheLastAirbender,https://i.redd.it/xtfvxzdb72wa1.png,47
Food prices are rising at a faster and faster pace,23878,europe,https://i.redd.it/xnw5uyzs00wa1.jpg,2115
Law and order,48566,HolUp,https://i.redd.it/h2nqtdkixzva1.jpg,392
"One man single handedly stops mob from looting store, what a legend 🤙 (I wouldn’t recommend doing this btw)",5915,JustGuysBeingDudes,https://v.redd.it/ooww7f8ms2wa1,263
NASA's Perseverance rover loses its hitchhiking 'pet rock' after more than a year together on Mars,18705,space,https://www.livescience.com/space/mars/nasas-perseverance-rover-loses-its-hitchhiking-pet-rock-after-more-than-a-year-together-on-mars?https://www.livescience.com/space/mars/nasas-perseverance-rover-loses-its-hitchhiking-pet-rock-after-more-than-a-year-together-on-mars,475
These bastards can't be decent human beings for like 5 minutes,9417,ToiletPaperUSA,https://i.redd.it/dm2p1eyw32wa1.jpg,271
Captain America vs American Predator,9559,marvelmemes,https://i.redd.it/ndw145a562wa1.jpg,68
Self-made success story,36112,MurderedByWords,https://i.redd.it/iv8a5rgmc1wa1.jpg,344
Satanic Temple’s ‘SatanCon’ in Boston set to be ‘largest satanic gathering in history’ | The event is dedicated to Boston Mayor Michelle Wu because “she denied the group from delivering a satanic invocation at City Hall and has used unconstitutional efforts to keep TST out of Boston's public spaces”,7320,atheism,https://www.masslive.com/news/2023/04/satanic-temples-satancon-in-boston-set-to-be-largest-satanic-gathering-in-history.html,141
"[Image] In 2020, I lost my job due to covid, my TV exploded and all I had to game was using a PS VITA Shareplay with my PS4. Sold both of them the same year to make ends meet. Now i got my life together again and decided to do a comparison",3400,GetMotivated,https://i.redd.it/ma1kzr8be3wa1.jpg,84
The latest water drinking technique,3554,AnimalsBeingDerps,https://v.redd.it/l92dn1dkc3wa1,75
The Bagworm Moth Caterpillar collects and saws little sticks to construct elaborate log cabins to live in,6463,natureismetal,https://i.redd.it/0qqm25rbi2wa1.jpg,91
"TIL the Steamboat Willie version of Mickey Mouse is set to enter the public domain in 2024, which means that anyone will be able to use or adapt this version of the character without fear of copyright infringement.",42121,todayilearned,https://www.cartoonbrew.com/law/steamboat-willie-copyright-mickey-mouse-2024-224477.html,2119
"When she told me she said ""now I see why you quote it all the time, it really is funny""",7218,AdviceAnimals,https://i.imgur.com/vnfdBKD.jpg,158
Poor? Have you tried starving?,4703,FunnyandSad,https://i.redd.it/j4eml0szu2wa1.jpg,346
Who wore it better?,10450,IASIP,https://i.imgur.com/cvDZtLz.jpg,153
"""tAxAtIoN iS tHeFt""",40220,WhitePeopleTwitter,https://i.redd.it/if9q5di362wa1.jpg,1567
Starting a GameCube themed island,3452,AnimalCrossing,https://v.redd.it/6e76engi93wa1,156
First person footage from a Ukrainian trench filming a Russian soldier surrendering to them,6956,CombatFootage,https://v.redd.it/bezaubums0wa1,498
What’s this move called?,8662,AnarchyChess,https://www.reddit.com/gallery/12ygw52,429
"[Mackey] Pirates and Bryan Reynolds have reached an agreement on a long-term extension, per sources. Eight years. $106,750,000. More to come.",3103,baseball,https://twitter.com/jmackeypg/status/1650887614625378305?s=46&t=1bTYmo6nQADPJApyYN_YdA,511
anime_irl,11417,anime_irl,https://v.redd.it/xj7inid6w1wa1,163
OC Where are they going?! 🐈‍⬛📣🐈,19206,aww,https://v.redd.it/p2rhwfqnc2wa1,655
"While in China, an American man is very sexually promiscuous and does not use a condom the entire time he is there.",15876,Jokes,https://www.reddit.com/r/Jokes/comments/12yehtk/while_in_china_an_american_man_is_very_sexually/,607
[homemade] Geode Cake,3847,food,https://www.reddit.com/gallery/12yl7r5,116
Name that anime..,2903,animememes,https://i.redd.it/x89qa9m5j3wa1.jpg,321
Can't Blaine him.,5198,justneckbeardthings,https://i.redd.it/lg836bwz51wa1.png,36
"""In the jungle, the mighty jungle, the lion twerks tonight ...""",12192,Eldenring,https://v.redd.it/suvt7zy190wa1,170
Wimbledon bans Russian flags and symbols of support for Russia and Belarus from this year's tournament and bars Russian journalists from attending,4556,sports,https://kttmv.com/articles/sports/20230425/wimbledon-bans-russian-flags-and-symbols-of-support-for-russia-and-belarus,165
Cannabis company offers jobs to all 400+ Burger King workers laid off in Michigan,3506,UpliftingNews,https://www.metrotimes.com/weed/cannabis-company-offers-jobs-to-all-400-burger-king-workers-laid-off-in-michigan-32950714,98
Two buddies says fuck you from all possible places,6441,FUCKYOUINPARTICULAR,https://v.redd.it/jwab3qpbv0wa1,144
[@Racingnews365C] Spot the differences!,6472,formula1,https://i.redd.it/11026nqaa2wa1.jpg,259
A potentially effective strategy,4204,depression_memes,https://i.redd.it/31pslvmvd1wa1.jpg,71
Are you a philosopher?,7834,terriblefacebookmemes,https://i.redd.it/a3kr2uisr0wa1.png,1402
behold the forbidden knowledge,18316,tumblr,https://i.redd.it/7d3ruerzv0wa1.png,81
Catnapped,2204,perfectlycutscreams,https://v.redd.it/j7l9usovd2wa1,14
Tucker Carlson is a socialist,7493,insanepeoplefacebook,https://i.redd.it/p2mqndpv32wa1.jpg,269
"The Westin Bonaventure Hotel, LA.",5523,DesignPorn,https://i.redd.it/f57c39m5f2wa1.jpg,129
[DISC] Chainsaw Man - Ch. 128 links,3219,ChainsawMan,https://www.reddit.com/r/ChainsawMan/comments/12ym2ab/disc_chainsaw_man_ch_128_links/,2366
Ukrainian Anti-Tank unit destroyed 4 Russian tanks (worth about 1.5 - 3M $ each) in under 4 minutes using Stugna Missiles (worth 20k $ each). Translated version.,2251,ukraine,https://v.redd.it/h064b615a2wa1,143
Dudes mind melts,6716,SipsTea,https://v.redd.it/9f65qkg4u0wa1,49
The Homeless Girl Who Died Loving Spider-Man (Friendly Neighborhood Spider-Man (2007) Annual 1),3112,Marvel,https://www.reddit.com/gallery/12ym4m5,212
Pajamas all day!,5087,antiwork,https://i.redd.it/2jnoaufly1wa1.png,193
"Yvonne Ho Appreciation Post. Without her, there would never have been an LTT.",4217,LinusTechTips,https://i.redd.it/we67fvoq91wa1.jpg,151
My doctor took me seriously on a gut feeling!,4804,TwoXChromosomes,https://www.reddit.com/r/TwoXChromosomes/comments/12yih37/my_doctor_took_me_seriously_on_a_gut_feeling/,139
Biden/Harris '24,5979,PoliticalHumor,https://i.redd.it/1v7tzwroo1wa1.png,542
MN House just passed cannabis legalization,1382,minnesota,https://i.redd.it/lgkn4x6og4wa1.jpg,217
My wife and I performed a choreographed lightsaber duel at our wedding on Saturday! ,8226,StarWars,https://v.redd.it/vpq6khcbh0wa1,397
"""Blindsided"" Tucker Carlson was Negotiating a New Contract When Murdoch Fired Him.",1812,NewsOfTheStupid,https://www.independent.co.uk/news/world/americas/us-politics/tucker-carlson-leaves-fox-news-fired-rupert-murdoch-dominion-b2326141.html?page=7,146
MRW Discount Tire tries to convince me to rotate my tires but I know all four rotated on the way there,2298,reactiongifs,https://i.redd.it/oygcer3v42wa1.gif,25
When you forget about the bike on your roof-rack,11348,IdiotsInCars,https://i.redd.it/z14liw6a20wa1.jpg,430
18 year old Karlos Nasar breaks all time world record Clean & Jerk with 221kg 487.2lb at 89kg.,10142,toptalent,https://v.redd.it/2af96n3s60wa1,360
Caught mid sneeze,2744,WhatsWrongWithYourCat,https://i.redd.it/yyq2549oc3wa1.jpg,12
Elon Musk accidentally revealed his alt account where he pretends to be a child and posts a lot of bizarre content,25839,Fauxmoi,https://www.reddit.com/gallery/12yc7q3,1694
My friend discovered a swarm of bees thriving in her walls,6104,mildlyinteresting,https://i.redd.it/9xxig4ff43wa1.jpg,374
Throwing a bowl with a tight lid,34284,oddlysatisfying,https://v.redd.it/8bjakf57g0wa1,354
Breaking news: Assault Weapons Ban is now officially law in Washington State,1684,SeattleWA,https://i.redd.it/ba7kjsoam2wa1.png,927
"Men shouldn't always be expected to make the first move, and it's the biggest reason for the loneliness epidemic",1636,unpopularopinion,https://www.reddit.com/r/unpopularopinion/comments/12yr80c/men_shouldnt_always_be_expected_to_make_the_first/,856
"Sweden launches research rocket, accidentally hits Norway",4023,worldnews,https://www.reuters.com/world/europe/sweden-launches-research-rocket-accidentally-hits-norway-2023-04-25/,408
Has Any Done this Shrine?,8171,Breath_of_the_Wild,https://i.redd.it/ggrq7fs1p2wa1.png,113
Reminder to lock your doors as soon as you're in the house,4572,TerrifyingAsFuck,https://v.redd.it/5z08npve01wa1,414
How to draw hands,2796,surrealmemes,https://i.redd.it/fdrrpw7vp1wa1.png,18
Stop filming ppl in need for clout,6511,LateStageCapitalism,https://i.redd.it/yd9qwjtxy1wa1.jpg,272
As you may have noticed: there was no comic last week,2034,TheWeeklyRoll,https://v.redd.it/a9cnfplvo3wa1,90
Cursed_game,2209,cursedcomments,https://i.redd.it/2524t4ny52wa1.png,34
For me it is more than Awesome.,4977,awesome,https://v.redd.it/xp1cuprfy0wa1,267
Am I wrong for firing my therapist immediately for expounding conservative views?,3684,NoStupidQuestions,https://www.reddit.com/r/NoStupidQuestions/comments/12yjuq9/am_i_wrong_for_firing_my_therapist_immediately/,983
"Mom watches 'Brave' for the first time, but more importantly croissants",9831,MadeMeSmile,https://v.redd.it/k0qpu6qv11wa1,111
Death metal story hour 🤘,2764,hellsomememes,https://i.redd.it/nwlo5317kxva1.jpg,83
"On the next episode of ""That Never Happens!""",1432,PoliticalCompassMemes,https://i.redd.it/alcgp4diq2wa1.png,284
Transgender Montana lawmaker Zooey Zephyr was again prevented from taking part in debate over a measure banning gender-affirming care while riot police forcibly remove everyone in the gallery.,2725,Political_Revolution,https://v.redd.it/ubc6u0zrf0wa1,191
"Sirius: Kreacher, how are you not murdered every hour?",5147,harrypotter,https://i.redd.it/lolkxfc192wa1.jpg,223
A stray mama just blessed us with some criminals ,11245,IllegallySmolCats,https://v.redd.it/glynw16luzva1,123
Imagine caring this much about a trans person literally just existing,3264,Persecutionfetish,https://i.imgur.com/191OzzN.png,313
/fit/izen explains how to beat addiction.,1932,4chan,https://i.redd.it/k8q366gso3wa1.png,87
Out of the way Padme I wanna see the Jedi,8377,starwarsmemes,https://i.redd.it/154soqnea0wa1.jpg,72
I unionized with my (26M) dogs against my boyfriend (30M).,1443,pettyrevenge,https://www.reddit.com/r/pettyrevenge/comments/12yr8tz/i_unionized_with_my_26m_dogs_against_my_boyfriend/,139
"One of the best archon quest cutscenes, if not the best, I've seen in the game.",2919,Genshin_Impact,https://v.redd.it/g3kxeft0l1wa1,196
Secretary birds are famous for its snake-stomping legs; a single kick delivered some 195 Newtons of force. They are also famous for their long eyelashes.,30589,Damnthatsinteresting,https://i.redd.it/zqie7mw541wa1.png,1037
Facts,36965,PrequelMemes,https://i.redd.it/c9u89smqd0wa1.jpg,407
The squad is out for hunting! (Animated by me),3386,Hololive,https://v.redd.it/5rbcm5mjb1wa1,46
Furries,11998,whenthe,https://v.redd.it/tuytg4js60wa1,332
