title,score,subreddit,url,num_comments
"Aurora over the Long Island Sound! Taken from Southold, NY",734,longisland,https://i.imgur.com/hzG1fVE.jpg,67
#darkbrandon,795,ofcoursethatsathing,https://i.redd.it/szljuy35a2wa1.jpg,59
" What could tô wrong, try to steal a bicycle in front of an army platoon",14649,Whatcouldgowrong,https://v.redd.it/dyd3sgfl5xva1,465
I'm going nuts,252,Vinesauce,https://i.redd.it/nxpwak8ym2wa1.jpg,13
How it feels biking in most US towns…,736,bicycling,https://i.redd.it/fig0ww87e2wa1.jpg,54
Hotdog Robot,208,shittyrobots,https://v.redd.it/990h4w9bh4wa1,8
D(r)ugs - just say no,1009,ScottishPeopleTwitter,https://i.redd.it/ajoktzupe1wa1.jpg,8
Should of been a mIRL,5667,Memes_Of_The_Dank,https://i.redd.it/d4yluqowgzva1.jpg,46
Cyber Beep's Final Form,504,Kenshi,https://i.redd.it/l3und85u03wa1.jpg,33
Guy takes on mob of looters by himself,428,Iamactuallyverybadass,https://v.redd.it/jsghlk0fy0wa1,24
Where is Universal blink?,1149,DotA2,https://i.redd.it/r29rmjwi61wa1.jpg,115
The pain,564,CharacterAI,https://i.redd.it/unv2rc77d1wa1.jpg,27
This has to be the quickest thinking any character has displayed on the show.,305,howyoudoin,https://i.redd.it/d8kytrdrt3wa1.jpg,19
As a European I feel the American culture was mocked big time in the last episode,986,SuccessionTV,https://www.reddit.com/r/SuccessionTV/comments/12ykeyr/as_a_european_i_feel_the_american_culture_was/,578
Don't Like WoTC? Here's A Site With Unlimited Free Magic!,714,EDH,https://www.reddit.com/r/EDH/comments/12yhyko/dont_like_wotc_heres_a_site_with_unlimited_free/,289
Miss Tick?,492,discworld,https://i.redd.it/rsqkcmf01yva1.jpg,11
Yup.,357,CarTalkUK,https://i.redd.it/y9r06pvkk3wa1.jpg,10
I’ll be spinning these today. RIP to a true legend!,453,vinyl,https://www.reddit.com/gallery/12ylung,18
Not oc,1394,PcBuild,https://i.redd.it/jxmslxebd1wa1.jpg,128
"Half of NYC households can’t meet their basic financial needs, report says",284,newyorkcity,https://gothamist.com/news/half-of-nyc-households-cant-meet-their-basic-financial-needs-report-says,53
it's happened one too many times,318,PhasmophobiaGame,https://i.redd.it/dxbnc8j692wa1.png,10
"My rentoid posted a landphobic meme on social media, what do I do Kings?",273,LoveForLandchads,https://i.redd.it/1mczjmb7j2wa1.jpg,26
Lure,517,animation,https://v.redd.it/fn8r3cbxa1wa1,41
Petition: Add A European Portuguese Course to Duolingo,811,portugal,https://www.change.org/p/tell-duolingo-to-add-a-european-portuguese-language-course?redirect=false,178
Most space optimized AAA game.,519,P1ZZ4_M0ZZARELL4,https://i.redd.it/4knyyhz8y2wa1.png,7
ralsapril 25: royal,468,ralsei,https://www.reddit.com/gallery/12ylj28,11
Bitch I'm a bit of a hybrid,278,BitchImATrain,https://i.redd.it/ws1htmb4z3wa1.jpg,7
Tucker Carlson Is Out at Fox News and QAnon Is Taking It Just Fine,567,Qult_Headquarters,https://www.vice.com/en/article/dy3vnx/tucker-carlson-fox-qanon,139
This is Betty. Betty plots against us.,4368,aww,https://i.redd.it/3nrm6qm811wa1.jpg,104
Honkai: Star Rail Day 1 Survival Guide,1012,gachagaming,https://www.reddit.com/r/gachagaming/comments/12yfgqt/honkai_star_rail_day_1_survival_guide/,302
[awesome] finally i have learnt to customize awesome and it is reallyyy awesome!!,550,unixporn,https://i.redd.it/5izd9tbcu2wa1.jpg,21
Just scratching my ear,2542,LooneyTunesLogic,https://v.redd.it/dgs5d6o6xyva1,13
Remote operating a wheel loader and an excavator,2180,toolgifs,https://v.redd.it/xiqk0n7e5zva1,109
HELP--I've been a hostage for over an hour & now I'm losing feeling in my feet!,474,cathostage,https://i.redd.it/k98p0bna33wa1.png,12
Keep on Keeping on,324,DeathStranding,https://i.redd.it/9mcxfmxko3wa1.jpg,2
Ohio's former Republican Gov. Bob Taft opposes making constitutional changes harder. “Especially bad public policy.”,729,Ohio,https://abc6onyourside.com/news/local/ohio-republican-governor-bob-taft-opposes-constitutional-changes-harder,92
The most ironic thing to happen in Limited Life,347,ThirdLifeSMP,https://i.redd.it/pz2hy75x22wa1.jpg,24
i feel like this has been done before but oh well,341,rainworld,https://i.redd.it/fnmiskmrl3wa1.jpg,13
Celebrating One Year of Reddit Community Funds,220,reddit,https://www.reddit.com/r/reddit/comments/12ysaqi/celebrating_one_year_of_reddit_community_funds/,91
The Vex are becoming an incredible threat.,743,DestinyLore,https://www.reddit.com/r/DestinyLore/comments/12yhhjx/the_vex_are_becoming_an_incredible_threat/,44
ong no cap?,815,femboymemes,https://i.redd.it/6h9kdls372wa1.png,11
"Another conceptual album, this time about the one, the only, Napoleon: Emperor",274,sabaton,https://i.redd.it/04hrcsz1h2wa1.png,21
I present to you my new yarn wall storage!,189,YarnAddicts,https://i.redd.it/n25cz94jm4wa1.jpg,24
gods,416,capybara,https://v.redd.it/4i1x22o6s1wa1,4
yeah thats my favourite place in the country,793,softwaregore,https://i.redd.it/9woinx6z73wa1.jpg,14
Beauty reflection,179,NicolaCavanis,https://v.redd.it/qgg624jx53wa1,2
Who needs RGB when you have this level of elegance?,690,battlestations,https://i.redd.it/kooeqjdsf3wa1.jpg,64
To understand about the capitalism vs communism debate is that there is no choice with communism; there is with capitalism,427,LibsOfSocialMedia,https://i.redd.it/98td28mdq1wa1.jpg,135
The rarest NPC in the game,282,swtor,https://www.reddit.com/gallery/12yq04l,50
I wish I sounded like a black woman,350,StandUpComedy,https://v.redd.it/uft0znx4k3wa1,6
The current weather status in Norway,797,Norway,https://i.redd.it/3pe88vs782wa1.png,46
Dwarf Mind Powers,775,beetlejuicing,https://i.redd.it/cj3k7k1s92wa1.jpg,3
Star Wars Jedi: Survivor Has Denuvo DRM,232,CrackWatch,https://www.reddit.com/r/CrackWatch/comments/12yrnf3/star_wars_jedi_survivor_has_denuvo_drm/,119
Klaus da Mouse is the most handsome boy.,487,Siamesecats,https://i.redd.it/cezpmyal13wa1.jpg,5
Jean [Genshin Impact],534,AnimeHoodies,https://i.imgur.com/ZomtUIG.jpg,2
AI generated Pizza commercial,623,Asmongold,https://v.redd.it/vej21gtzl2wa1,78
"This object and its description is a perfect representation of the current state of The Sims 4 and how veteran simmers reminisce about the ""good old days"" of the franchise when it was actually good",1014,thesims,https://i.redd.it/5pv69dsmb1wa1.png,62
Bunny’s hidden daggers 🗡️,220,murdermittens,https://i.redd.it/m7htmcvvc4wa1.jpg,0
Blursed Redditor,690,blursed_videos,https://v.redd.it/dvffh7wog2wa1,7
The last image of my great-grandma Peggy in 2002. She died of old age at 97 the following month in hospital but this was our last photo together. Her first words when she met me were “can I hold the wee baby?” as she couldn’t remember my name.,878,lastimages,https://i.redd.it/cczkrjte22wa1.jpg,19
When the shitpost gets more upvotes than the high effort post,656,CalamityMod,https://v.redd.it/6ek48l5ui2wa1,22
Breaking News: Local Transphobe gets absolutely DESTROYED by smart person..,315,AccidentalAlly,https://i.redd.it/dlro93ju72wa1.jpg,10
"Yo, Second Dinner - can we get some Tradd Moore variants please?",500,MarvelSnap,https://www.reddit.com/gallery/12yqaka,49
happy 25th of april to all italians and to all the portuguese brothers with whom we share the day our countries returned free,272,YUROP,https://v.redd.it/gep2rrnbg2wa1,7
"Start of my full sleeve, and first tattoo! By Sebastian Carmargo in Toronto",467,tattoos,https://i.redd.it/263d8qwe34wa1.jpg,15
No more work,315,Anarchy4Everyone,https://i.redd.it/gbsxci5482wa1.jpg,5
"Hi, it's Karun Chandhok. Join me for a live AMA!",477,india,https://www.reddit.com/r/india/comments/12yl1j6/hi_its_karun_chandhok_join_me_for_a_live_ama/,431
That’s a wrap on Season 3! 🎬,294,OnlyMurdersHulu,https://v.redd.it/8465wot6t3wa1,20
Did you do this? We were gods,473,FuckImOld,https://i.redd.it/4x0r92f6k1wa1.png,29
"Elevator in the Marine Building, Vancouver British Columbia",666,ArtDeco,https://i.imgur.com/UEOQjHT.jpg,22
Road rage in UK,586,fightporn,https://v.redd.it/yaao8hx272wa1,66
This DS2 enemy looks like a Zdzislaw Beksinski painting,610,DarkSouls2,https://i.redd.it/44d5sq0r41wa1.jpg,23
Hell - Siege of Terra,326,ImaginaryWarhammer,https://i.redd.it/qfmidyku73wa1.png,8
We were here before it launched!,2145,HonkaiStarRail,https://www.reddit.com/r/HonkaiStarRail/comments/12yefy1/we_were_here_before_it_launched/,726
Buttons (Art by @Cess_Nea),436,HazbinHotel,https://i.redd.it/iqwo1l9o53wa1.jpg,9
Saw this car in my neighborhood. Anyone know what it is??,296,namethatcar,https://i.redd.it/35nsvizzs3wa1.png,60
My fat loaf of bread 🤣,721,orangecats,https://i.redd.it/ri8cnu48d2wa1.jpg,5
Nearly finished my er34!,1543,JDM,https://i.redd.it/7pzez8qh51wa1.jpg,62
This is how we have to cut eleanors nails 🤣,907,Dachshund,https://i.redd.it/mug2bvr9z2wa1.jpg,41
Lighter wunk,268,wunkus,https://i.redd.it/1jie23e0z3wa1.jpg,3
My wife and I (the now Mr. and Mrs. Universe) did our wedding first dance to No Matter What on Saturday!,943,stevenuniverse,https://v.redd.it/mt90aq8wf0wa1,43
Her: He's probably out cheating,387,GCSE,https://i.redd.it/sft7qgquc3wa1.jpg,39
How I Defeated Blakism With The Power Of Love - By Devlin Stone,581,battletech,https://i.redd.it/wnydgw5081wa1.png,48
look at my lawyers dawg😭😭😭i’m going to jail,666,SpidermanPS4,https://i.redd.it/hyzenaggh3wa1.jpg,29
[OC] What if Three Houses had an Engage-styled arena?,1057,fireemblem,https://v.redd.it/ymi7vn5k71wa1,53
"Not the exact homecoming moment, but she wasn't going to let anyone leave again anytime soon.",458,MasterReturns,https://i.redd.it/mggaxmj8m1wa1.jpg,7
"Bo Burnham reference in John Mulaney's new special ""Baby J""",615,boburnham,https://v.redd.it/9hbwfu4h41wa1,46
AMD announces Ryzen Z1 and Z1 Extreme chips for handheld gaming PCs,564,hardware,https://www.theverge.com/2023/4/25/23696722/amd-ryzen-z1-z1-extreme-rog-ally,221
Perfect chair for the office,738,UnusualVideos,https://v.redd.it/cxh9h3g6u0wa1,33
"Form 10/10, Mindset 12/10 Execution 1/10",938,MakeMeSmile,https://v.redd.it/h3cfspmxf0wa1,8
It's 86 degrees out. You can take off your Law Review sweatshirt.,710,LawSchool,https://www.reddit.com/r/LawSchool/comments/12yhno3/its_86_degrees_out_you_can_take_off_your_law/,76
Millions of people worshipping a giant foot in the middle of town,491,weirddalle,https://www.reddit.com/gallery/12ykry9,43
HMFT after I slip 'n slide,1703,holdmyfeedingtube,https://streamable.com/0r4ej8,80
Feeling This - Coachella weekend 2,398,Blink182,https://v.redd.it/vhjlod6ga3wa1,35
So WoTC did an Oopsie,3464,dndmemes,https://i.redd.it/8opzl919u2wa1.jpg,105
Transphobes: stop talking about autistic people,505,AutisticPride,https://i.redd.it/c0nyrac6f1wa1.png,33
My modpack Create Stellar just officially launched on curseforge!,945,feedthebeast,https://www.curseforge.com/minecraft/modpacks/create-stellar,147
"Out of Cruel Space, Part 663",187,HFY,https://www.reddit.com/r/HFY/comments/12yudb5/out_of_cruel_space_part_663/,66
Diana corrects Akko on what is canon,290,LittleWitchAcademia,https://i.redd.it/p6lt0tc4b2wa1.jpg,9
My heart sank,783,gmod,https://v.redd.it/iezz41h4q0wa1,27
Everything comes at a cost (A.G. Nonsuch),630,RWBY,https://www.reddit.com/gallery/12ynx27,61
"Unfortunately, it's already cropped",1333,poland,https://i.redd.it/ztv6f2icd1wa1.jpg,31
When is thing insanity gonna end?,10197,lgbt,https://i.redd.it/ue4lonnr2yva1.jpg,291
Get ready to learn Chinese buddy,475,nbacirclejerk,https://i.redd.it/5ylgu1db04wa1.jpg,31
Trying to enter a pedestrian zone,1167,IdiotsInCars,https://i.redd.it/jdzqt59bj3wa1.jpg,87
Literally.,3066,dankmemes,https://i.redd.it/t7lnc7m4n1wa1.gif,62
Butlerian Jihad will be hard for humanity in more ways than one,444,dunememes,https://i.redd.it/grndvdvb43wa1.jpg,9
"lovely rain for lunch in Ulsan, South Korea today",442,raining,https://v.redd.it/21tvah7um1wa1,6
He's become MAGA Musk. Just got a Tweet from Trump Jr. on my feed.,486,EnoughMuskSpam,https://i.redd.it/cfj0m0uwg1wa1.jpg,18
“I’m priced out of the housing market. That’s a provincial election issue to me”,448,canadahousing,https://www.cbc.ca/news/canada/calgary/humam-shwaikh-opinion-project-housing-1.6814601,219
Every single time,757,slaythespire,https://i.redd.it/tidvgbh7r0wa1.jpg,29
Things I’m just not going to do for the sake of beauty,364,beauty,https://www.reddit.com/r/beauty/comments/12yn57n/things_im_just_not_going_to_do_for_the_sake_of/,212
Tank On Ryan Garcia: I’d Say He’s Best Fighter I've Fought; Just Felt I Was A Level Above Him,492,Boxing,https://www.boxingscene.com/tank-on-ryan-garcia-id-say-hes-best-fighter-ive-fought-just-felt-i-level-above-him--174139,151
WHHHAAAAAAAAHHHHT? I couldn’t watch this without laughing!!!,228,90dayfianceuncensored,https://v.redd.it/dnmzfsi074wa1,70
aespa - The 3rd Mini Album: MY WORLD (Concept Photo - A Strange Phenomenon Ver. - Karina & Winter),783,kpop,https://www.reddit.com/gallery/12ylyqg,47
"Political Map of Tamriel during ESO, set after all current dlc/chapters",208,elderscrollsonline,https://i.redd.it/73ll0xtzw2wa1.png,44
Which boss got you like this?,1884,fromsoftware,https://i.redd.it/8rmq3eems0wa1.jpg,306
Spell Republican: H-Y-P-O-C-R-I-T-E,398,ToiletPaperUSA,https://i.redd.it/4gtaa3f4c4wa1.jpg,53
"good morning humans, what are you up to?",991,kittens,https://i.redd.it/ha1yzd8vs1wa1.png,24
Volume 24 cover,477,BlueLock,https://i.redd.it/aqpq8mh003wa1.jpg,44
Can You Guess How Old I am Today?,401,BroadCity,https://i.redd.it/mvhd0u5393wa1.jpg,14
"Whither goest thou, young rogue?",1078,calvinandhobbes,https://i.redd.it/amggiprq51wa1.jpg,29
[OC] Rika and Clodsire,761,PokemonScarletViolet,https://i.redd.it/zdvdtm3t72wa1.png,26
"Guy starts fight, gets what he deserves ",282,FightsGoneWildpt2,https://v.redd.it/xll1ll8hu3wa1,40
Cow scratcher,900,happycowgifs,https://i.imgur.com/i3yqgmr.gifv,12
Last night in Linz be like,946,arcticmonkeys,https://i.redd.it/yxcmjvqvd0wa1.jpg,58
I will not take Pablo slander,255,Transformemes,https://i.redd.it/q5684v22z3wa1.jpg,17
[NHL Player Safety] Colorado’s Cale Makar will have a hearing today for Interference against Seattle’s Jared McCann.,2071,hockey,https://twitter.com/nhlplayersafety/status/1650846098431377415?s=46&t=Kn6aGl07LOrGYksC8Og5bQ,962
Round 1 Game #4. Toronto 5 Tampa 4. OT,1119,leafs,https://i.redd.it/lm3rs5ook2wa1.jpg,91
"My sweet Paladin loves to be held like this. He’s a weird boy, but we love him! ❤️",333,Flamepoints,https://i.redd.it/qn829r6wj3wa1.jpg,19
"""You're new here, aren't you?"" Herblock, 1961",772,europe,https://i.redd.it/vwvpo7o0o2wa1.png,57
SiCk wiTcH tuRnS pOor dUck inTo a fuCkiNg baNaNa,5776,PeopleFuckingDying,https://i.redd.it/wpd9km4c50wa1.jpg,32
Almost had 'em,5000,HolUp,https://v.redd.it/xcowtu0uy0wa1,55
Come get some😤😤😤,173,Hardcore,https://v.redd.it/qkj589mjn4wa1,4
Sand dollars are flat sea urchins that move on a mat of tiny spines. They use these and cilia to move food or food-coated sand toward a central underslung five-plate mouth to be ground and scraped clean. After life the spines and cilia come off leaving the famous test we find bleached on the sand.,224,Awwducational,https://www.youtube.com/watch?v=848pA7OvJzk,5
hmmm,735,Minecrafthmmm,https://i.redd.it/72e82jgc02va1.png,12
What’s your favorite joke in the series?,4687,adventuretime,https://i.redd.it/e484nb1td0wa1.jpg,177
Boccher Impact,1020,BocchiTheRock,https://i.redd.it/qknr460191wa1.jpg,17
Nimeä bändi,358,Suomi,https://i.redd.it/zg8j691ye3wa1.jpg,213
"According to Denis Villeneuve, while Dune was shot 40% in IMAX, DunePart2 was shot in full IMAX.",157,boxoffice,https://twitter.com/Luiz_Fernando_J/status/1650953371266740227?t=nSzs2skdDg66TQDSid6xig&s=19,50
"Over the past 15 years, the Earth's accumulated heat has increased by 50%, with most of the extra going into the oceans. Not only did the overall temperature of the oceans hit a new record in April this year, in some regions the difference from the long term was enormous.",3361,science,https://www.bbc.co.uk/news/science-environment-65339934,226
House decries teacher pay raises while passing $100M tax break on oil from wells,687,Louisiana,https://www.reddit.com/gallery/12yhpkl,108
Lyme Disease Public Service Announcement,648,discgolf,https://www.reddit.com/r/discgolf/comments/12yi49l/lyme_disease_public_service_announcement/,200
Don't be like these kids,602,Miata,https://v.redd.it/zdvmy7py31wa1,166
You guys like my NFS Undercover phone theme?,241,needforspeed,https://i.redd.it/60sz47qsk2wa1.png,19
Are U Team Sugar Or Team Salt ? 😅,680,Tekken,https://i.redd.it/f2h8jg9xd2wa1.jpg,134
Found this gem on my home page,324,TheLeftCantMeme,https://i.redd.it/9ff0ik41l3wa1.jpg,62
Viva black Mesa aperture science es un pendejo,726,HalfLife,https://i.redd.it/yk3w8nnz83wa1.png,47
"Customer service: Hello, We are here to help you",9518,FunnyandSad,https://i.redd.it/8izvwtbvizva1.jpg,171
Shell admits 1.5C climate goal means immediate end to fossil fuel growth,506,Futurology,https://www.resilience.org/stories/2023-04-24/shell-admits-1-5c-climate-goal-means-immediate-end-to-fossil-fuel-growth/,75
I'll get you next time when he's not around!,2029,CatsAreAssholes,https://v.redd.it/yzy0ip76uyva1,36
Collection of my SAO portraits,405,swordartonline,https://www.reddit.com/gallery/12ym5a5,22
Celestial Nighthawk for that *chefs kiss,732,DestinyMemes,https://i.redd.it/vfy6y3t1r1wa1.jpg,10
Why is this car sinking in a sinkhole so satisfying??,759,satisfying,https://v.redd.it/bjl6825up0wa1,95
Leopard soaks up the sun with a morning stretch.,291,forbiddenboops,https://i.redd.it/320ip0aq82wa1.png,11
Endless source energy 😍😍,371,DivinityOriginalSin,https://i.redd.it/rqb7c6vdd3wa1.jpg,13
POV: A multibillion dollar toy company decided it's your fault you got the math game cardboard before their e-celebs,261,freemagic,https://i.redd.it/rn8pfzy9g2wa1.jpg,44
"""With twins, one of them is always evil; it's Cagney."" Made me think about my twins. Is one too young to decide which one is evil?",1230,brooklynninenine,https://i.redd.it/rz618ofgw0wa1.jpg,35
Morton’s Coarse Kosher Salt has become increasingly coarse,612,Cooking,https://www.reddit.com/r/Cooking/comments/12yig1n/mortons_coarse_kosher_salt_has_become/,287
Our SpringDapperDay Looks,172,Disneyland,https://www.reddit.com/gallery/12yu5ad,19
Only one person is capable of hosting this trainwreck,578,LoveIsBlindOnNetflix,https://i.redd.it/okj5p4dpm3wa1.jpg,19
she is a women,1090,oddlyspecific,https://i.redd.it/d6vci5xy41wa1.png,35
anime_irl,1844,anime_irl,https://i.redd.it/tqoe5je3s1wa1.png,73
Don't copy me hooman,788,WatchDogsWoofInside,https://v.redd.it/ktecwicmm0wa1,5
Kansas City considers becoming a transgender ‘safe haven’ in defiance of Missouri laws,636,transgender,https://www.kcur.org/news/2023-04-25/kansas-city-considers-becoming-a-transgender-safe-haven-in-defiance-of-missouri-laws,25
fr,358,DragonMaid,https://i.redd.it/2ngrxqxaf3wa1.jpg,5
It really be like this,376,canadaguns,https://i.redd.it/2gfk0aobv1wa1.png,54
Sending Email in a Public phone,2817,RetroFuturism,https://i.redd.it/rm5luzi530wa1.jpg,95
"Didn’t have rope to tie down my trunk, but did have an ethernet cable in my trunk",547,techsupportmacgyver,https://i.redd.it/unkje41hp2wa1.jpg,25
The Satanic Temple Of Missouri Adopted The Street In Front Of The Church of Scientology In KC👌,263,missouri,https://i.redd.it/3x2xzhc3w3wa1.jpg,21
AITA for ending a friendship after being interrogated by the ethics department,254,TwoHotTakes,https://www.reddit.com/r/TwoHotTakes/comments/12yqaku/aita_for_ending_a_friendship_after_being/,67
New Poster for 'The Witcher' Season 3,897,witcher,https://i.redd.it/nz1109gef1wa1.jpg,248
"Arctodus simus isolating a bison calf to kill and eat, not necessarily in that order",812,Naturewasmetal,https://i.redd.it/yqznvofh22wa1.jpg,8
Democrats in a chokehold,3276,PoliticalCompassMemes,https://i.redd.it/x790eox2x1wa1.jpg,1604
Water Bed - by hebitsukai,251,wimmelbilder,https://i.redd.it/7pmesveph2wa1.jpg,1
When Irons dare to ask for updates,856,ironscape,https://i.redd.it/55kghskeh0wa1.png,277
Buddy was chilling on a staircase railing. HUUUUGE feets!! [Midwestern US],423,whatsthisbird,https://i.redd.it/p19dijrv33wa1.jpg,43
*no further context provided*,200,shittymobilegameads,https://v.redd.it/2gyehzb4d4wa1,14
Merrin deserves her own game to be honest...,385,MandalorianMemes,https://i.redd.it/3drjc9w0a3wa1.png,8
Nero redraw,293,BlackClover,https://i.redd.it/mljwgmb8p3wa1.png,13
The antennae is supposed to be his tiny brain I didnt mean to make him look like the Reddit Guy please believe me,206,SmugIdeologyMan,https://i.redd.it/h8ta1o35t2wa1.png,9
Rimuru,333,TenseiSlime,https://i.redd.it/4gbjx6eki3wa1.png,16
Joe Biden will be 81 years old when he runs for re-election. A younger version of him once criticized an opponent for being too old at 63.,643,Conservative,https://notthebee.com/article/joe-biden-will-be-81-years-old-when-he-runs-for-re-election-he-once-criticized-an-opponent-for-being-much-much-younger-than-that,57
"Actor and comedian Eddie Murphy, and his hit pop song, Party all the Time!",301,80s,https://youtu.be/iWa-6g-TbgI,67
woof_irl,582,woof_irl,https://i.redd.it/aqsi2murl2wa1.jpg,0
"The EARN IT bill is back. We've killed it twice, let's do it again! 💀💀💀",3366,technology,https://tutanota.com/blog/posts/earn-it-barr-encryption,156
pipebomb,567,tf2shitposterclub,https://v.redd.it/opg2kxd052wa1,6
Eiendomsmegler brutt regler?,318,norge,https://www.reddit.com/r/norge/comments/12yo6uw/eiendomsmegler_brutt_regler/,96
This Straw Lion,779,OddSatisfying,https://v.redd.it/xqc7cz5rm0wa1,5
No more work,536,freefromwork,https://i.redd.it/gbsxci5482wa1.jpg,2
TIL that Lesion can Bite people if you don't equip a Stance,775,Warframe,https://www.reddit.com/gallery/12ylihx,88
Going hard at 11,690,CrusaderKings,https://i.redd.it/eww26uwau0wa1.png,34
Hey! This is the last commission I made. What do you think? His name is Barrage and he is a Lawful Neutral Conrasu Monk with the Fireworks Technician archetype. More information about the character in the comments. (Note: I have 7 slots open for commissions.),599,Pathfinder2e,https://i.redd.it/h14qlr0i11wa1.jpg,51
Fancy cat,280,catpictures,https://i.redd.it/kuqw6gx8s3wa1.jpg,5
Lord Squak Airavis,397,Dimension20,https://i.redd.it/zqie7mw541wa1.png,15
and feel I'm a toxic person,1106,depression_memes,https://i.redd.it/tdbr62uu11wa1.png,42
Japanis man slice-of-life,428,japanesepeopletwitter,https://v.redd.it/94qaftk4l1wa1,23
A baby cougar enjoying a short stay at the Oregon Zoo vet center,488,babybigcatgifs,https://gfycat.com/anygracefulazurewingedmagpie-oregonzoo-bigcats,1
Ana | sheer black,523,AnadeArmas,https://www.reddit.com/gallery/12yjj0z,2
"Just put more sand piles around the houses built on sand, Edge Homes, should be fine.",252,Utah,https://i.redd.it/sl29salpy3wa1.jpg,64
The Forced Auction scam my wife and I fell for in October 2020 (still in operation after 25 years),445,Scams,https://www.reddit.com/r/Scams/comments/12yl23w/the_forced_auction_scam_my_wife_and_i_fell_for_in/,70
“Look into my eyes and everything will be alright”,4630,Overwatch,https://v.redd.it/cyvvql8ovzva1,222
Which one of these aspects is the Most important for any Bender to have in a fight? I'd say good defense/ versatility is key,849,legendofkorra,https://i.redd.it/pw34wv0yy1wa1.jpg,59
this band is lit!,755,submitted,https://v.redd.it/i5ja4nnao0wa1,35
"Glasses of the Nerd, when a joke cursed item idea ends up being take too seriously",691,UnearthedArcana,https://i.redd.it/7mnofphat0wa1.png,42
"Huey Lewis and the News at the Oakland Coliseum in 1987, performing ""Back in Time""",2292,OldSchoolCool,https://v.redd.it/554857z6u0wa1,211
short by @nyogetsu,1373,PERSoNA,https://i.redd.it/tnt0spx4p0wa1.png,22
Find out if you're an Average (Orange) Joe Omori player based on results of the polls.,340,OMORI,https://i.redd.it/q10oc0blh3wa1.jpg,191
Down the diving rabbit hole.,295,subnautica,https://v.redd.it/8r20apgji1wa1,37
But she says it wasn't the policy of the United States!,281,CommunismMemes,https://v.redd.it/qvq4ew1z82wa1,8
Breakfast of champions,548,outofcontextcomics,https://i.redd.it/7qg07fxto2wa1.png,30
Man caught by metro ,211,insanereality,https://v.redd.it/fqwhgqk9q2wa1,47
why the hell is there a bird in the house.. is it okay? its just blinking at me..,451,birdpics,https://i.redd.it/xxuk51s8i1wa1.jpg,38
I Don’t think it’s phoning home…,269,SpaceXMasterrace,https://i.redd.it/6unh2djqt3wa1.jpg,36
In an alternate Universe Bobby ran for President while Dean became a Hobo,176,Supernatural,https://i.redd.it/6h14kf1sk4wa1.jpg,15
"""In this room we respect Client Confidentiality except for government secrets. They are watching, Boss""",1512,metalgearsolid,https://i.redd.it/he99kliti0wa1.png,12
Forbidden Owl Romance,170,Superbowl,https://www.reddit.com/gallery/12yu4rd,7
“PutPotatoChipsOnASandwich!!” - Liz Lemon,358,30ROCK,https://www.reddit.com/gallery/12ymvh0,25
Beyond adorable!,434,AnyaTaylorJoy,https://v.redd.it/ebmc17z8j1wa1,5
"Zagreus, Son of Hades",179,custommagic,https://i.redd.it/8loxktqz03wa1.png,67
"After 26 weeks, Anti-Hero falls out of the top 10.",906,TaylorSwift,https://i.redd.it/8j24dzufu2wa1.jpg,88
Coming soon,1724,balkans_irl,https://i.redd.it/evlxaw6it1wa1.jpg,65
Live cable connection to his onscreen guitar,443,confusingperspective,https://i.redd.it/xr5eth37j1wa1.jpg,9
true kino,239,Jujutsufolk,https://i.redd.it/a3dsurw414wa1.png,8
This giant dragon protecting its island.,197,IRLEasterEggs,https://i.redd.it/41yg1kkev2wa1.jpg,5
Blursed_Duck,521,blursedimages,https://i.redd.it/d8c6q64jq3wa1.jpg,14
guys I'm making a card game that involves random pictures please give me the most out of context shit,845,doodoofard,https://i.redd.it/mvnrzsesx2wa1.jpg,1059
Just one more year!! Can't wait to see this!,343,FlashTV,https://i.redd.it/07ftwvbke3wa1.jpg,42
