title,score,subreddit,url,num_comments
"I’ve played this game quite a good amount of hours and I’m just now noticing this recipe banner, rock salt, silent shroom, goat butter and Tabantha wheat?",1022,botw,https://i.redd.it/0y5iph8ep2wa1.jpg,107
Catsu and potato Cascat,634,Berserk,https://i.redd.it/0xsgtp4pg3wa1.jpg,22
I got in trouble for saying vagina,824,exmormon,https://www.reddit.com/r/exmormon/comments/12ylcxh/i_got_in_trouble_for_saying_vagina/,224
The city of Akron has already had a federal injunction placed on them prohibiting them from tear gassing protestors so they have resorted to car jacking residents over seat belt violations,515,worldnewsvideo,https://v.redd.it/bu5tl9x0b2wa1,63
character concept,2801,CuratedTumblr,https://i.imgur.com/J9GMit0.jpeg,187
"SHUT TF UP ABOUT PEOPLE'S GENDER, I'M TRYING TO GET AROUND ON TIME",1429,THE_PACK,https://i.imgur.com/uZ2Z2Ic.jpg,24
He was making biscuits on my face 😫,608,cats,https://v.redd.it/1oimphnyj4wa1,60
2meirl4meirl,10649,2meirl4meirl,https://i.redd.it/64dyun64yyva1.jpg,45
Attack on Titan but it's Malaysia:,441,ShingekiNoKyojin,https://i.redd.it/7rg8vz6u14wa1.jpg,12
Male streamer vs Female streamer,393,UpvoteBecauseButt,https://v.redd.it/cu33mp5d71wa1,15
A wooden miniature excavator,1584,mechanical_gifs,https://imgur.com/H440EMW.gifv,14
Man dies inside after breaking down pipe with object he dropped from roof,22103,WatchPeopleDieInside,https://v.redd.it/fpv6i98ghxva1,383
Unpopular opinion: If two countries unite peacefully you should also get their research tech,1544,hoi4,https://www.reddit.com/r/hoi4/comments/12yg3uz/unpopular_opinion_if_two_countries_unite/,94
The Signal and the Noise,3693,educationalgifs,https://i.redd.it/k66cblxt6zva1.gif,73
Goofy boy,482,CatTaps,https://v.redd.it/xwnhb319e2wa1,2
WhatsRightWithYourDog,598,WhatsWrongWithYourDog,https://v.redd.it/5wyjn4r923wa1,29
Why is the U.S. silent??? Your entire mainstream media is nothing but a propaganda machine that propagates sheer disinformation 😂,507,ShitLiberalsSay,https://i.redd.it/317gse7ms3wa1.jpg,44
HMC while I pretend nothing happened,701,holdmycatnip,https://v.redd.it/5674iv2z93wa1,5
The crossover we needed!,454,Doom,https://i.redd.it/ttkdirtdz3wa1.jpg,13
F25. Curious since I’ve never asked before…,427,truerateme,https://www.reddit.com/gallery/12yr3ah,212
It’s my brother’s first day working in emergency ambulance service. So proud of him!,762,happy,https://i.redd.it/qju96ads43wa1.jpg,26
A masterpiece,824,Discordmemes,https://v.redd.it/s7ctfpwx03wa1,33
Agreed!,2774,WhitePeopleTwitter,https://i.redd.it/h06mvkna14wa1.jpg,154
I don’t speak Taco Bell,1331,MemeVideos,https://v.redd.it/fq03yavi92wa1,25
Slowest God this side of Hell. Hermes is probably frothing from his mouth somewhere,802,HadesTheGame,https://v.redd.it/jsfq9m23j1wa1,18
Got a high-five from a bumblebee today,1380,ireland,https://v.redd.it/2oplwladp0wa1,53
Parody photos by Celeste Barber showing how celeb Instagram selfies don't live up to reality,1323,ExpectationVsReality,https://www.reddit.com/gallery/12yh3oy,94
RIP flag of Serbia dog (context in comments),589,vexillologycirclejerk,https://i.redd.it/9qpcwmb9k3wa1.jpg,18
Revere Beach Massachusetts 1980s,722,boston,https://i.redd.it/2j7r5z6lu2wa1.jpg,78
Was the year and day duration the same back in the Jurassic Era?,1912,askscience,https://www.reddit.com/r/askscience/comments/12yekof/was_the_year_and_day_duration_the_same_back_in/,301
My tiny house I started building exactly a year ago! Moved in last August,358,TinyHouses,https://www.reddit.com/gallery/12yschf,30
[Fallout 4] Just Dogmeat Things,523,GamePhysics,https://v.redd.it/0em80j3n92wa1,5
What has gradually disappeared in the UK that no one noticed?,342,AskUK,https://www.reddit.com/r/AskUK/comments/12ysw81/what_has_gradually_disappeared_in_the_uk_that_no/,535
Kings-Warriors Game 4 was the most-watched first round game since 2002,2546,nba,https://www.sportsmediawatch.com/2023/04/kings-warriors-ratings-game-4-most-watched-first-round-nba-game-21-years/,260
Those sample haircuts explain the name.,928,engrish,https://i.redd.it/8sfgty2ib1wa1.jpg,16
"Meet Canyon! Squeaking, chirping, sniffing, she does it all!",371,Catswhoyell,https://v.redd.it/w3aqhguys2wa1,6
Good to see the tourist got open mind about trying new stuff in India.,1464,WhyWomenLiveLonger,https://v.redd.it/oy49wgyfl0wa1,90
big startled cat,6163,StartledCats,https://v.redd.it/fog7avej00wa1,41
Well you know what? Now I’m going to propagate it even harder!!,574,proplifting,https://i.redd.it/i334qtxik3wa1.jpg,40
Analemma over the Callanish Stones [Image Credit: Giuseppe Petricca],3690,spaceporn,https://i.redd.it/2glmq3il5zva1.png,40
Without a,1210,woooosh,https://i.redd.it/vj6ddtotv0wa1.jpg,26
"When Rebecca's mouth does the ""😦"" thing",504,Edgerunners,https://i.redd.it/3dgl1zfea2wa1.png,7
You can see the exact moment he goes to sleep ,901,germanshepherds,https://v.redd.it/ufnkeqgtt2wa1,27
"Rain, rain, don’t go away 🌻🌧️",515,femalelivingspace,https://i.redd.it/1l5obx56q3wa1.jpg,23
"“Lady Kryze, your reinforcements have arrived”",1661,TheMandalorianTV,https://www.reddit.com/r/TheMandalorianTV/comments/12yfco2/lady_kryze_your_reinforcements_have_arrived/,180
This Cast is just to good not to share,4084,oddlysatisfying,https://v.redd.it/v792j3l5z1wa1,72
Defibrillator toaster,329,DidntKnowIWantedThat,https://i.redd.it/p6iauqo5i4wa1.jpg,8
Little help Karen ?,380,TIGHTPUSSY,https://i.redd.it/takgxt4aq2wa1.png,7
The alarm clock that everyone seemed to have,18765,nostalgia,https://i.redd.it/6gu0ccshtyva1.jpg,638
9 out of 10 Republicans silent on Trump’s calls to terminate the Constitution,2667,politics,https://www.citizensforethics.org/reports-investigations/crew-reports/9-out-of-10-republicans-silent-on-trumps-calls-to-terminate-the-constitution/,186
Man charges into giant dust devil,10433,perfectlycutscreams,https://v.redd.it/dkv7wtt74zva1,263
it s true tho,371,xmen,https://i.redd.it/r83250vj94wa1.jpg,48
"Just want to say, instant speed proliferating just as your opponent tries to pop their battle is one of the best feelings in standard right now.",697,magicTCG,https://www.reddit.com/r/magicTCG/comments/12ym8xs/just_want_to_say_instant_speed_proliferating_just/,87
Trump being best president.,4490,yesyesyesyesno,https://v.redd.it/lgh1vael4yva1,215
Imagine this being your life as a grown adult,2686,Gamingcirclejerk,https://i.redd.it/6oj1ukja32wa1.jpg,234
Ontario scrapping post-secondary education requirement for police recruits,845,canada,https://www.cbc.ca/news/canada/toronto/ontario-police-recruitment-changes-1.6821382,623
Richard Eden nails it on Twitter,427,SaintMeghanMarkle,https://i.redd.it/dn4kqjfs14wa1.jpg,67
My galaxy-themed creation,1031,Astronomy,https://www.reddit.com/gallery/12yiq1w,25
cursed_pewdiepie,6185,cursedcomments,https://i.redd.it/qajwxpxzr0wa1.jpg,127
"If you're wondering why Tucker Carlson suddenly left Fox, this is a good start",1145,Fuckthealtright,https://i.imgur.com/o66qaVd.jpg,43
Absolute Unit of a Spider,2001,AbsoluteUnits,https://i.redd.it/fa8b0dk121wa1.jpg,318
Kirby with Anya Forgor (Spy x Family),518,Kirby,https://i.redd.it/t4dmtxose0wa1.jpg,28
Change My Mind: Avatar Ripped Off Lion King II: Simba's Pride,698,AvatarMemes,https://i.redd.it/3fdd1r13ejv61.jpg,38
r/Kanye stays winning,457,Kanye,https://i.redd.it/jxahezrlw3wa1.jpg,26
"Ismét április, nyúlj magadhoz még ma!",467,hungary,https://www.reddit.com/r/hungary/comments/12ypsnr/ismét_április_nyúlj_magadhoz_még_ma/,48
Polite cat asks to be let out ,423,politecats,https://v.redd.it/urceyy2ri2wa1,11
"LPT: Stay away from gossipers. Gossipers feel fun/exciting, but they inevitably drive wedges between people, ruin reputations, and break up people’s friendships and relationships. Instead, befriend people who mind their own business.",10879,LifeProTips,https://www.reddit.com/r/LifeProTips/comments/12y8sy4/lpt_stay_away_from_gossipers_gossipers_feel/,339
The science behind why some people prefer marijuana to alcohol | “People tend to choose whether to drink or smoke because they’re partial to the experience they’ll get from their particular choice.”,646,savedyouaclick,https://web.archive.org/web/20230425152514/https://statenews.com/article/2023/04/the-science-behind-why-some-people-prefer-marijuana-to-alcohol?ct=content_open&cv=cbox_featured,62
Dog's ear hair extraction,1029,FeltGoodComingOut,https://v.redd.it/uyrbpqa331wa1,41
"Made a bar graph of the weather pattern, boss",485,NotMyJob,https://i.redd.it/4ynp4dpcb2wa1.jpg,17
MHA figure drawing practice from this month!,694,BokuNoHeroAcademia,https://www.reddit.com/gallery/12ym6en,36
I want Ike to fucking destroy me,334,gaymers,https://i.redd.it/gylu041fe4wa1.jpg,23
I think I like 'sassy mom' like Masaki better than a 'violent mom',1251,bleach,https://i.redd.it/5syrfbcs92wa1.jpg,112
DICE added a thick44 playercard to the game after his passing,1767,battlefield2042,https://i.redd.it/qxdohran70wa1.jpg,116
New doctors avoid residencies in states with abortion bans,1322,TwoXChromosomes,https://www.axios.com/2023/04/18/abortion-ban-states-drop-student-residents,30
Is this what Kelly THINKS she’s doing?? 😭,441,FundieSnarkUncensored,https://v.redd.it/hw0lpl82y3wa1,70
Imagine if it was Akainu instead of Smoker 💀,1816,MemePiece,https://i.redd.it/7a9y11aa61wa1.png,193
Watching The Operations Room video on the Battle of the Philippine Sea and how 'operation Z' was intercepted reminded me some other negative naval moments involving Z,1253,Military,https://i.redd.it/oa7v25ls82wa1.jpg,36
Poofing earthstars to release their spores ,2074,mycology,https://v.redd.it/jrd4tw85g1wa1,109
Don’t forget the beer on the way out,3349,ContagiousLaughter,https://v.redd.it/f6olbfxap1wa1,75
"Behind the scenes flashback: Filming ""Heeeere's Lassie"" and that time the paparazzi photographed Timothy Omundson on location, in wardrobe....",448,psych,https://i.redd.it/xd0ls11ie2wa1.jpg,18
The post above this will be deemed the child,1504,SCP,https://i.redd.it/84x3bq6ty1wa1.jpg,90
Surprises are the best :),433,UnexpectedlyWholesome,https://i.redd.it/4y7aol4tg2wa1.png,2
Ukrainian aviation destroys a house where russian infantry are stationed (video shows the use of American JDAM bombs),1102,UkraineWarVideoReport,https://v.redd.it/ngejltt5z1wa1,84
"LAOP's dad has a construction company that hires undocumented workers and doesn't have workers comp insurance. An employee got stuck by lightning. The legal term for dad is ""mega fucked.""",664,bestoflegaladvice,https://www.reddit.com/r/legaladvice/comments/12y5qnd/one_of_my_dads_employees_were_struck_by_lightning/?utm_source=share&utm_medium=android_app&utm_name=androidcss&utm_term=1&utm_content=share_button,154
I made a sandwich and ate it,878,eatsandwiches,https://www.reddit.com/gallery/12yjxkg,36
Why I always play on easy,930,HaloMemes,https://i.redd.it/625qnkse81wa1.png,24
Based meth user,542,PhilosophyMemes,https://i.redd.it/h5f93s95m3wa1.jpg,47
Literally,1402,MarchAgainstNazis,https://i.redd.it/p751evqk13wa1.jpg,29
My bad,2401,PewdiepieSubmissions,https://v.redd.it/bslqoya6d1wa1,24
Lamb playing hide and go seek.,436,babyanimals,https://v.redd.it/06ddmmjph1wa1,5
jealous kitty (credit: @delgadohomestead on instagram),887,PetTheDamnCat,https://v.redd.it/z2xrrs6ds2wa1,4
The difference of these two subs summarised in one picture.,1429,trees,https://i.redd.it/vx0z89i903wa1.jpg,58
Not technically MTB but know some of the fellow old guys will appreciate this,397,MTB,https://v.redd.it/88phypgbvjka1,40
Ryan Mason via Instagram,362,coys,https://i.redd.it/y0a7bvo784wa1.jpg,49
I am truly obsessed with a random painting of a chair. I can't even explain it to myself. WIP. Oil paint on canvas.,591,painting,https://i.redd.it/huubxv4cy1wa1.jpg,37
"A Nashville senior was banned from prom for a suit, so a local business stepped in",1744,UpliftingNews,https://www.npr.org/2023/04/25/1171695996/nashville-senior-banned-from-prom-suit-dress,265
Door Don't In Block! Use!,333,dontdeadopeninside,https://i.imgur.com/X7NuxEm.jpg,38
Just an annual ceremony for the tribal chief,911,Wrasslin,https://i.redd.it/p7bdr4k2q2wa1.jpg,67
boring ahh political campaign,818,TurkeyJerky,https://v.redd.it/m6osngnnf1wa1,29
I Tossed a Wedding Album,448,declutter,https://www.reddit.com/r/declutter/comments/12yps6p/i_tossed_a_wedding_album/,29
"""Spring came first to the temple on the edge of the known world...""",547,FairytaleasFuck,https://i.imgur.com/Qnu00Aj.jpeg,7
What the fuck is wrong with this sub,1895,btd6,https://i.redd.it/l9oci3xq30wa1.gif,71
My Arm Tastes Good,1320,HappyWoofGifs,https://v.redd.it/e10pwibwm0wa1,4
Halo Gates (TBC x Emerald Gates),865,shrooms,https://i.redd.it/e6emmetht2wa1.jpg,84
New sticker design!,608,lgbtmemes,https://i.redd.it/ym17eowde3wa1.jpg,12
Lesbian Kick!,3146,ComedyCemetery,https://i.redd.it/9un5czo4ezva1.jpg,265
My kinda surprise,24672,wholesomememes,https://i.redd.it/1z4z2q4uq1wa1.png,124
Last chance to look at me Hector,907,okbuddychicanery,https://i.redd.it/g7bxql4bq3wa1.png,22
"Silky absolutely serving, not only in looks but with an important message at the Florida Drag March!",869,rupaulsdragrace,https://v.redd.it/trei7aavr3wa1,52
Furry Dragon Ball,1054,Ningen,https://i.redd.it/3995wbd601wa1.jpg,49
Broken Vessel,554,HollowKnight,https://i.redd.it/5xk3b4go02wa1.jpg,12
no one can argue that 🤣,2232,NoMansSkyTheGame,https://i.redd.it/y4rvapnra1wa1.jpg,161
[B/R Football] Taty Castellanos is the first player since 1947 to score FOUR on Real Madrid in La Liga,321,MLS,https://twitter.com/brfootball/status/1650938346787446811?s=46&t=ip1ke5aQcWhYQwd-2FUDMg,71
Shreddin' through blizzards 📸 🏂,1348,snowboarding,https://v.redd.it/lye6n93kj0wa1,112
"""Hello. Hi. Pet me please? Oh yeah, that is nice.""",1956,rarepuppers,https://i.imgur.com/LX9PMcn.gifv,10
Adopted this little senior street dog when she was 10 years old. She just turned 15 and is still living her best life on our couch. Give the oldies a chance.,1309,BeforeNAfterAdoption,https://www.reddit.com/gallery/12yghnt,28
A rare sighting,3327,dankvideos,https://v.redd.it/71fcyv6fr1wa1,26
*salute*,1260,FunnyAnimals,https://i.redd.it/9yv5gi2p53wa1.gif,19
Facts,846,NotHowGirlsWork,https://www.reddit.com/gallery/12ypitr,39
"Bam Margera threatened dad, punched brother, fled into woods, police say",5433,entertainment,https://ew.com/celebrity/bam-margera-threatened-father-hit-brother-police-say/,869
Not my cat greeting me at 4am ,1140,notmycat,https://v.redd.it/zvwyjvh3c2wa1,12
Encountered this polite little fella...,772,mildyinteresting,https://v.redd.it/ap7bl54ah1wa1,108
"It was fun while it lasted, friends. But I've received my long-awaited cease and desist on r/Delta bag tags. All existing orders will be fulfilled. No future orders can be allowed.",959,delta,https://i.redd.it/rtpxnxch41wa1.png,296
Hillary Clinton: Republicans Are Playing Into the Hands of Putin and Xi,2081,inthenews,https://www.nytimes.com/2023/04/24/opinion/hillary-clinton-debt-ceiling-republican-dollar.html,333
"Nate Silver Out at 538, ABC News at the end of his contract",462,neoliberal,https://www.hollywoodreporter.com/business/digital/nate-silver-leaves-538-abc-news-disney-layoffs-1235401689/,251
Real team USA roster,489,Competitiveoverwatch,https://twitter.com/usaowwc/status/1650903724028579840?s=46&t=VhYEFEHCbS8jd6n8-Xwapw,133
What's the origin of the children's game where you see a Volkswagen Beetle and punch another child?,610,AskHistorians,https://www.reddit.com/r/AskHistorians/comments/12ymuaf/whats_the_origin_of_the_childrens_game_where_you/,39
You are going to go to school tomorrow,1990,teenagers,https://i.redd.it/rbyk58izh2wa1.gif,393
"Zowort? No, this is [Z A W A R U D O]",541,Gunpla,https://www.reddit.com/gallery/12ynwe0,28
Idk why I love toxic broken women!,637,FallenOrder,https://i.redd.it/nes12efp93wa1.jpg,99
So what other rhyming mantras can we all come up with?,602,KingOfTheHill,https://i.redd.it/2286kx57c3wa1.png,108
"My lunch at a conference - a cube of beef, a spoonful of mash, all served in a tiny copper pan!",1249,WeWantPlates,https://i.redd.it/9q75e5f762wa1.jpg,50
improvised explosive device,1397,197,https://i.redd.it/lvfbx7t203wa1.gif,19
Major Fifthist L,713,DankMemesFromSite19,https://v.redd.it/yuqa4r79l1wa1,22
Texas agriculture commissioner orders employees to wear clothes “consistent with their biological gender”,1442,texas,https://www.texastribune.org/2023/04/24/sid-miller-agriculture-department-texas-anti-trans-dress-code/,331
Arden (16) has been doing amazing these last two weeks after some medication changes and laser treatments. I am so lucky to have this time with my best friend.,291,OldManDog,https://www.reddit.com/gallery/12ytfqy,11
Dodge Viper GTS-R [4828 x 2716],1604,carporn,https://i.redd.it/xzc50rki90wa1.jpg,25
Hoshino Ai wants a hug.,811,AnimeART,https://i.redd.it/0a6o9go3v2wa1.jpg,8
Turkish Air Force F-16s and F-4s are flying in the Bosphorus within the part of TEKNOFEST2023 [Album],369,WarplanePorn,https://www.reddit.com/gallery/12yrckd,17
We're all going to jail,302,CODWarzone,https://i.redd.it/b5iexu9fz2wa1.jpg,29
"Seriously, who do you prefer?",553,memeframe,https://i.redd.it/q0dooibsz1wa1.jpg,49
This can’t be real,334,tomorrow,https://v.redd.it/ol2g1h6ab4wa1,11
The future liberals want,367,F1NN5TER,https://i.imgur.com/JWoVIx9.jpg,26
Divorce court claims another victim.,316,Hasan_Piker,https://v.redd.it/u8dhgu65e4wa1,72
Recently re-watched JFK. What a good movie.,1097,seinfeld,https://i.redd.it/ag71fscdv0wa1.gif,62
I joined the skeletons,914,Seaofthieves,https://v.redd.it/3whjrrk161wa1,12
The real MVP,612,startrekmemes,https://i.redd.it/isfqpe41b3wa1.jpg,44
Found this in a book.,513,BirdsArentReal,https://i.redd.it/h8ajgr3z32wa1.jpg,17
Only as a pair!,2927,facepalm,https://i.redd.it/thjgmuubb1wa1.jpg,172
Yo Dawg,1619,formuladank,https://i.redd.it/ygoi44ufp3wa1.jpg,41
Do these bases look easy to make?,945,DungeonsAndDragons,https://v.redd.it/niasft5r31wa1,48
Chair,972,AccidentalCamouflage,https://v.redd.it/ha7g688521wa1,15
HMC while i… whatever she was trying to make,245,holdmycosmo,https://v.redd.it/kd5n5ipaw2wa1,25
This is the least flattering photo I’ve taken in all my years of rescue.,941,WhatsWrongWithYourCat,https://i.redd.it/njydcyi7l3wa1.jpg,15
Wrong way to tap a keg,989,nononono,https://v.redd.it/b8wn1rlr01wa1,46
Texas Agency Threatens to Fire People Who Don’t Dress ‘Consistent With Their Biological Gender’,760,DeFranco,https://www.vice.com/en/article/n7ebag/texas-ag-transgender-dress-code-memo,176
My favorite Maya Rudolph sketch: National Anthem. Never fails to crack me up!,797,LiveFromNewYork,https://v.redd.it/0izjdttvc1wa1,75
Antiquarian has had enough... Time for CONFIDENT STAB!,1210,darkestdungeon,https://i.redd.it/j6t99ofvo0wa1.gif,20
Thoughts on color change. Was blue,603,Audi,https://www.reddit.com/gallery/12ymo3s,151
One of the most unluckiest players with Chelsea alongside Torres I miss him he was underrated. Yes he used to miss chances but he was the one making amazing runs behind the defenders I would rather have an energetic striker like Timo who misses some his chances than Lukaku. He loved the club :(,758,chelseafc,https://v.redd.it/bojhsi1le1wa1,152
Unvaccinated woman denied organ transplant surgery.,1576,HermanCainAward,https://i.redd.it/78h80tehr1wa1.jpg,243
In case you're wondering why it feels like everyone is getting sick lately... It's because they are. Put on a mask!,488,vancouver,https://i.redd.it/l9memskk52wa1.png,227
"at CinemaCon in Las Vegas, April 2023",341,MargotRobbie,https://www.reddit.com/gallery/12yrqfi,10
‘Dune’ Part 2 With Timothée Chalamet and Zendaya Teased at CinemaCon,302,dune,https://www.hollywoodreporter.com/movies/movie-news/dune-sequel-trailer-movie-timothee-chalamet-austin-butler-1235399584/,91
We patched up the ozone hole back then. We will stabilize our planet's climate,537,hopeposting,https://i.redd.it/n0jtkk1kh3wa1.jpg,22
Do you think Sora would be so forgiving to Larxene in kh3 if he remembered how awful she was in CoM? Lol.,755,KingdomHearts,https://i.redd.it/79yxtee1x2wa1.gif,115
Starship program iteration 2016 - 2023.,597,SpaceXLounge,https://i.redd.it/pzilqphxa3wa1.png,85
Only just realized Leia screams “It’s a Trap!” a whole movie before Admiral Ackbar ,1963,StarWars,https://v.redd.it/rgqtm1i3d3wa1,86
"The ""new smoke shop that just opened up down the block from the other smoke shop"" starter pack",1511,starterpacks,https://i.redd.it/f5el1de8b1wa1.png,111
"""I really liked the human centipede part""- former friend",804,TrashTaste,https://i.redd.it/u1jzf6qtt2wa1.jpg,30
Godwars,2887,2007scape,https://v.redd.it/uslwnlrs80wa1,114
Stomping tantrum amoongus for gholdengo (explanation in comments),881,stunfisk,https://i.redd.it/9jy3l9ztn2wa1.jpg,99
"""BEHOLD""",871,MemeHunter,https://i.redd.it/2iqr8kef71wa1.jpg,40
UNBGBBIIVCHIDCTIICBG,293,sportsarefun,https://v.redd.it/2asc9tz6y2wa1,19
3.21 Death Song Synthesised Titanium Spirit Shield - 951ES shield,1550,pathofexile,https://www.reddit.com/gallery/12yf34p,262
Unreal loyalty to the academy,433,CricketShitpost,https://i.redd.it/l17aqox5t3wa1.jpg,50
Monster Hunter but in Pokemon artstyle,564,MonsterHunter,https://i.redd.it/22siv18ke3wa1.jpg,19
Sudden Frostbite Syndrome,316,fakedisordercringe,https://i.redd.it/4693w4tld4wa1.jpg,76
In the Crosshairs of a Generation,2372,PoliticalHumor,https://i.redd.it/w97xfzmqj1wa1.jpg,317
This car. These colors.,391,AccidentalWesAnderson,https://i.redd.it/ceasx7p5z3wa1.jpg,16
Grim circumstances,654,deadbydaylight,https://v.redd.it/ii24fvbsn1wa1,23
VALORANT Patch Notes 6.08,894,VALORANT,https://playvalorant.com/en-us/news/game-updates/valorant-patch-notes-6-08,237
To the glorious hero that’s only re-enlistment request was a BN donsa this Friday.,465,army,https://www.reddit.com/r/army/comments/12yov1n/to_the_glorious_hero_thats_only_reenlistment/,67
"Once you quest this way, it's hard to stop",655,Wizard101,https://i.redd.it/skkhwpkb53wa1.jpg,44
"60% of the time, it works every time. [New Avengers 2010]",1815,Marvel,https://i.redd.it/t8bw8cwvg2wa1.jpg,122
Lamborghini Murcielago,925,lego,https://www.reddit.com/gallery/12yo09x,28
Meet Geronimo in his special seat,504,catbellies,https://www.reddit.com/gallery/12yo3hf,1
what is that car?,472,whatisthiscar,https://i.redd.it/j5tyfnyso3wa1.jpg,67
Carlsbad Caverns National Park. 2/12/23,974,NationalPark,https://www.reddit.com/gallery/12yi6ox,24
Original character (with\without helmet),502,StarWarsCantina,https://www.reddit.com/gallery/12ynze4,30
When you finally get that car ride you’ve been asking for,538,WiggleButts,https://i.redd.it/76nl7ck7g3wa1.jpg,7
Steven Crowder is getting divorced… i wonder if he’s going to ask Wrinks for any advice,350,thefighterandthekid,https://v.redd.it/3k155e6264wa1,215
So cool! Almost unreal Van Gogh like clouds,671,CLOUDS,https://i.redd.it/ql9a9nyn23wa1.jpg,40
Is this the Dennis I have herd so much about 😱😎😎🔥,595,chainsawmancirclejerk,https://i.redd.it/xbmbwk0t93wa1.jpg,33
Perfect size trap to catch a Coconut!,780,TheCatTrapIsWorking,https://i.redd.it/oz8axhh3u2wa1.jpg,8
Lesbian Kick!,621,GatekeepingYuri,https://i.redd.it/9un5czo4ezva1.jpg,45
"Over 70% short - New record, hedgies desparate",770,GME,https://i.redd.it/xlyfmheim1wa1.png,24
This ammonite is around 185 Million Years Old,26727,Damnthatsinteresting,https://v.redd.it/xg3rm5jq40wa1,341
Poor man’s Reese’s. Peanut butter and Nutella on toast.,956,shittyfoodporn,https://i.redd.it/u6if1dhyi2wa1.jpg,85
Just kick it. It will fit,1125,criticalblunder,https://v.redd.it/y12fk038r0wa1,82
"Fr*nce, Belg*im we don’t care you are the buffer zone for the next European between potatoes and tomatoes",1683,2westerneurope4u,https://i.redd.it/0dme48chl2wa1.jpg,265
Antivaxer bet me $30k I would die from the “jab” in three years. He responded to my 2-year reminder email via a comment on an Instagram video 🤦‍♂️,790,insanepeoplefacebook,https://i.redd.it/r98uxdqks3wa1.jpg,62
"The Type 88-2, a North Korean version of the AK-74 with a top-folding stock and a Bizon-looking helical magazine. Reportedly holding over 150 rounds, this weapon has been in service since about 2010.",569,CursedGuns,https://i.redd.it/v65mpm0bt1wa1.jpg,45
Imaging having to pay to get your entry ticket instantly on your phone (seen on ticketmaster),1566,assholedesign,https://i.redd.it/9fg30ypg71wa1.png,45
luigi irl,1232,luigi_irl,https://i.redd.it/5cspa2fowc251.jpg,20
The melding of two art forms.,589,toptalent,https://i.imgur.com/dLtLL5f.gifv,21
"OK, I have no idea what happening here...",612,CrazyFuckingVideos,https://v.redd.it/mknu3l4xq2wa1,41
"Holiday rental villa with huge windows near the Iporanga Beach in Guarujá, São Paulo state, Brazil [6000x4000]",2237,RoomPorn,https://i.imgur.com/pPPwFDX.jpg,17
"Finally got all the parts to ""de-gimp"" my Benelli",603,guns,https://i.redd.it/5hzksh3x83wa1.jpg,31
"Relationship of Pick Rate, Win Rate, and Show Up Rate for all the cards in Mega Draft - Clash Royale",562,ClashRoyale,https://i.redd.it/ix6m289sv1wa1.png,53
Thanks guys ❤️,407,bonehealingjuice,https://i.redd.it/zjgzalnnd2wa1.png,5
How can we get rid of corporate swag at conferences?,658,Anticonsumption,https://www.reddit.com/r/Anticonsumption/comments/12yqvkn/how_can_we_get_rid_of_corporate_swag_at/,136
Kuma turned 15 today 🥳,387,shiba,https://www.reddit.com/gallery/12yq6s0,19
You know I keep that MF thang on me,338,maryland,https://www.reddit.com/gallery/12yrho8,35
Ludwig goes full Slime,245,LudwigAhgren,https://i.redd.it/tb6fp5td73wa1.png,18
Gun control works. Trust me. ,766,brandonherrara,https://v.redd.it/llst0yv0d1wa1,28
Now she can hear from miles,651,mildlysatisfying,https://v.redd.it/593r3phsm1wa1,116
Brain can't handle,998,WeDoALittlePosting,https://v.redd.it/jdve1ptgx0wa1,22
Jaywalking monitor captured a suspect on camera,10380,likeus,https://i.redd.it/2ma3xghp3zva1.jpg,88
