title,score,subreddit,url,num_comments
"PWInsider: ""CM Punk was in Florida over the weekend doing commentary for MMA promotion Cage Fury Fighting Championships. When flying out of Tampa yesterday, he ended up on the same flight as several WWE talents and staff, including one Producer and was sitting next to some of them on the flight..",2023,SquaredCircle,https://www.pwinsider.com/ViewArticle.php?id=170506,556
"They found Elon's burner account, where he pretends to be his toddler son, talks about porn, and says Grimes' kids must hate her bc she broke up with Elon.",550,ElonJetTracker,https://www.reddit.com/gallery/12yc7q3,59
"COVID response exposed ""collective national incompetence,"" commission says",1247,Coronavirus,https://www.axios.com/2023/04/25/covid-response-national-incompetence-commission?utm_source=twitter&utm_campaign=editorial&utm_medium=social,75
TotK is now arriving within the sell by date of milk.,2330,tearsofthekingdom,https://i.redd.it/ap7xy4d0d2wa1.jpg,121
Traffic stop goes Horrifically wrong for two police officers,2954,TerrifyingAsFuck,https://v.redd.it/ewl1cohbi1wa1,1380
"Party crashers wreck house at 3208 Stoner Avenue, Los Angeles, CA, 1953",1977,TheWayWeWere,https://www.reddit.com/gallery/12yitrf,84
Grandma Shadow looking majestic at 18 years old,1509,seniorkitties,https://www.reddit.com/gallery/12ylacy,15
Gibby's Bass Drop skin with the Peacekeeper is obnoxious. Arm shield blocks the whole crosshair.,1125,apexlegends,https://v.redd.it/u963scgu02wa1,63
Drawing compared to reference photo!,1891,drawing,https://i.redd.it/whfpxn3kp2wa1.jpg,80
freefromwork,2379,freefromwork,https://i.redd.it/15s8rcejrzfa1.jpg,18
Bridesmaid Lehenga for an Indian Wedding,1103,sewing,https://www.reddit.com/gallery/12ynuwg,18
"ULPT Request, how do I ruin a dangerous kid at my school's life without getting in a ton of trouble?",1794,UnethicalLifeProTips,https://www.reddit.com/r/UnethicalLifeProTips/comments/12yjm58/ulpt_request_how_do_i_ruin_a_dangerous_kid_at_my/,238
Based,1461,UNSUBSCRIBEpodcast,https://i.redd.it/xcaqa7sjl1wa1.jpg,318
I just set up a date entirely through GIFs 🤣,942,Bumble,https://www.reddit.com/gallery/12yp8db,75
PsBattle: cat sitting and yawning,1365,photoshopbattles,https://i.redd.it/r71r5fsh63wa1.jpg,34
"Finally finished my bathroom after 2 years, a night and day difference! Before/after of the work (Virginia Beach, VA)",858,AmateurRoomPorn,https://www.reddit.com/gallery/12yq3y7,60
Gruß aus der Küche: Deutscher Kraftriegel-Salat,2117,de,https://i.redd.it/2a98wd1qz0wa1.jpg,134
Reminder: Britain's bourgeois institutions are the enemies of the people.,922,GreenAndPleasant,https://imgur.com/BKAoqC6.jpg,62
THE FAKESAW MAN IS REALLLL!!!,2280,ChainsawMan,https://i.redd.it/ryp19rs2b3wa1.png,85
[LoZ] Those of us who played the NES game first be like..,889,zelda,https://i.redd.it/6exz2hpwd2wa1.jpg,184
Criminal being confronted by police officers at his job,1835,CrazyFuckingVideos,https://v.redd.it/qy13jp70p2wa1,295
D.C knew what they were writing,613,theyknew,https://i.redd.it/ndzslmcpi4wa1.jpg,17
Can Pinky Dance? .........,819,SuccessionTV,https://i.redd.it/1hcgzc3pi2wa1.gif,89
Bank of England economist says people need to accept they are poorer,3068,worldnews,https://www.bbc.co.uk/news/business-65308769,522
This happened to my buddy Eric,1687,lies,https://i.redd.it/dsq931jnc1wa1.jpg,114
I love the little bits of comedy in Metroid Prime,1902,Metroid,https://i.redd.it/r8ktq4d7m2wa1.jpg,86
Como é que é,1825,brasil,https://i.redd.it/oh9cpgwwo2wa1.jpg,223
I know where I'm going on holiday this year...,1316,CasualUK,https://i.imgur.com/m2g1cLN.jpg,144
The Reddit superiority starter pack,1600,starterpacks,https://i.redd.it/v09j8r2fw2wa1.jpg,128
"The last interview with ex-deputy of Verkhovna Rada (Parliament of Ukraine) Ukrainian MP, Oleh Barna, who died at the front. RIP to a literal hero. 🇺🇦",3167,ukraine,https://v.redd.it/gguli7etr2wa1,50
Me and my bestie getting married,1110,SapphoAndHerFriend,https://i.redd.it/6z4opag5h3wa1.jpg,19
Trump being best president.,4484,yesyesyesyesno,https://v.redd.it/lgh1vael4yva1,215
My neighbor’s buff cat on his way to beat my cat’s ass,591,CatsAreAssholes,https://i.redd.it/fx5w6ku0l4wa1.jpg,42
Protect you self at all times.,1487,agedlikemilk,https://i.redd.it/54y1sn4503wa1.jpg,49
poor pepekton mains,4648,LeagueOfMemes,https://i.redd.it/2ca9mmxjf1wa1.jpg,415
Kitten 🐱 or Squirrel 🐿,7884,OneOrangeBraincell,https://i.redd.it/3exxxk3li1wa1.jpg,105
We are all in a simulation,2908,im14andthisisdeep,https://i.redd.it/ir2gsbf8i0wa1.jpg,105
Housing has NEVER been less affordable than it is now,3534,LateStageCapitalism,https://i.redd.it/cnw9ehvl11wa1.png,125
Gatekeeping…..plants?,1337,gatekeeping,https://i.redd.it/oohzoxwc53wa1.jpg,40
Man stabbed so hard between the eyes kitchen knife reached his brain,2292,NoahGetTheBoat,https://metro.co.uk/2021/07/25/woman-stabbed-man-so-hard-between-the-eyes-it-reached-his-brain-14986614/,178
If only Mac made the choice to focus on the one’s who loved him,1429,MacMiller,https://i.redd.it/z4zj0mid03wa1.jpg,121
"""You Can't do that on Television"" 80s kids skit show Nickelodeon.",1023,GenX,https://en.wikipedia.org/wiki/You_Can%27t_Do_That_on_Television,180
just a scenic country road,1941,evilbuildings,https://i.redd.it/cs6cc8d2j2wa1.jpg,67
I am on the bullies side!,2971,IAmTheMainCharacter,https://v.redd.it/rsna4my0x1wa1,535
Rule,2634,197,https://i.redd.it/6f8pmfru22wa1.jpg,37
The Dozen-Dollar Strut,1297,PaymoneyWubby,https://i.redd.it/x6llhgi5n1wa1.jpg,21
Electro player when they kill electro in death domains then proceed to play 1 card per turn anyways,1531,MarvelSnap,https://i.redd.it/yodexvrdw2wa1.jpg,121
College Dorm move out season!,838,Frugal,https://www.reddit.com/r/Frugal/comments/12ypx9q/college_dorm_move_out_season/,112
no fucks were given that night,1200,rimjob_steve,https://i.redd.it/bh4gzjf51zva1.png,13
This guy is speaking god's language we're too dumb to understand.,1819,MildlyVandalised,https://i.redd.it/4b9y6rdj41wa1.jpg,25
"Sytho | 07th Expansion - rog-unlimitation [AngelHoney] (AngelHoney, 9.82*) +NC 98.25% FC | 1140pp | 109.64 cv. UR | HIS NEW TOP PLAY!",1411,osugame,https://i.redd.it/9selun11n1wa1.jpg,48
the wonders of technology,2159,OTMemes,https://i.redd.it/sz7lpzqiw0wa1.jpg,21
I know the book isn't that new but this design surprised me in the best way,1204,comicbooks,https://i.redd.it/0nymmbir93wa1.jpg,34
Gotta teach em young,13538,shitposting,https://i.redd.it/gr0fyye6t0wa1.png,93
Spaghetti Ann Meatballs is taking her permit test,1499,torties,https://i.redd.it/81f8j4row2wa1.jpg,46
I never understand how people ride dumb with passengers and not give them a helmet.,1269,motorcycles,https://v.redd.it/bckdei0l63wa1,230
[No Spoilers] Yasha & Beau tattoo by me!,914,criticalrole,https://i.redd.it/purr712mp3wa1.jpg,34
Got this little tattoo to remember my brother who passed away last year. I miss him.,681,TheSimpsons,https://i.redd.it/hqxz4fp484wa1.jpg,14
This guys glass lamp is amazing,484,BetterEveryLoop,https://i.imgur.com/xb1TC2q.gifv,21
That point where the chain becomes indistinguishable from the darkness…,615,thalassophobia,https://v.redd.it/7pjeir78d4wa1,14
you know up close you froggies are kind of cute,1201,Konosuba,https://i.redd.it/g0gc43vi93wa1.jpg,9
Introducing Pawn Editor!,909,RimWorld,https://www.reddit.com/gallery/12yoxn9,116
Drawing badly until TOTK - Day 898,4261,Breath_of_the_Wild,https://i.redd.it/76f03gd183wa1.png,83
why do you American teens buy iPhones over others despite them being so overpriced,2659,teenagers,https://www.reddit.com/r/teenagers/comments/12ygs8z/why_do_you_american_teens_buy_iphones_over_others/,1261
"Pearl Street, Boulder, Colorado. (2021 vs 2023)",1107,notjustbikes,https://i.redd.it/llr9nkbuv1wa1.png,83
Suleiman the Magnificent,1030,balkans_irl,https://i.redd.it/szewkhd0i3wa1.jpg,70
Restaurant owner prevents kidnapping attempt with a rear naked choke.,3550,HumansAreMetal,https://v.redd.it/iatd3s3340wa1,178
FIFTY FIFTY partners with record label Warner Records,1419,kpop,https://www.billboard.com/pro/fifty-fifty-warner-records-partnership-cupid-group/,89
⠺⠓⠁⠞ ⠺⠕⠥⠇⠙ ⠽⠕⠥ ⠇⠊⠅⠑ ⠞⠕ ⠎⠑⠑ ⠊⠝ ⠎⠏⠊⠙,1228,SpidermanPS4,https://i.redd.it/ubfic6jx73wa1.jpg,45
FIA president Mohammed ben Sulayem accused of sexism and bullying,2960,formula1,https://www.telegraph.co.uk/formula-1/2023/04/25/mohammed-ben-sulayem-fia-sexism-bullying-shaila-ann-rao/,489
Ukrainian soldier firing an SPG-9 with a 9V battery.,2575,CombatFootage,https://v.redd.it/ytqmpuz4h1wa1,100
my math skills must be rusty,28852,comics,https://i.redd.it/o1af1g1g20wa1.png,506
South America truly is built different.,1180,Kaiserreich,https://i.redd.it/dej2hdf593wa1.jpg,40
Upcoming buffs/nerfs teased!,854,hearthstone,https://i.redd.it/6st4x39ga2wa1.jpg,683
"Apreciation post for Genevieve O'Reilly as Mon Mothma. I just finished Andor (late, i know) and i loved every minute she was on screen",1601,StarWars,https://i.redd.it/rajfqcmqp3wa1.jpg,61
I made a chocolate cream pie,1689,Baking,https://www.reddit.com/gallery/12yj9ew,73
Who cares about mountains and rivers. I propose Europe-Asia border is now 40°E Longitude Line.,2942,mapporncirclejerk,https://i.redd.it/pgoq1qs2d0wa1.png,197
Me waiting for $FRC bulls to post their loss porn,2772,wallstreetbets,https://i.redd.it/kt078ioqe1wa1.jpg,289
"Abusive, lazy boyfriend.",1287,povertyfinance,https://www.reddit.com/r/povertyfinance/comments/12ylitn/abusive_lazy_boyfriend/,327
Seminary-Trained Professor Charged in Revolting Child Sex Abuse Sting,1852,byebyejob,https://www.thedailybeast.com/seminary-trained-professor-rod-githens-charged-in-revolting-child-sex-abuse-sting,135
Why no one is giving lecture on environment? ,1623,IndiaSpeaks,https://v.redd.it/3umaj2t3a1wa1,191
"You know, I'm something of a battlestation myself.",1835,battlestations,https://i.redd.it/ve4ot5ob11wa1.jpg,152
facing a mill deck as reanimator,1346,MagicArena,https://i.redd.it/h0bfxfz1j1wa1.png,122
That comeback left some residue,12146,clevercomebacks,https://i.redd.it/2pk4wbey51wa1.jpg,231
Pokémon gameplay vs Pokémon lore,1687,pokemonmemes,https://v.redd.it/ktfunhaso2wa1,33
"Palazzo Borromeo, Italy",1045,ArchitecturePorn,https://i.redd.it/3m6qw5off3wa1.jpg,22
Whenever anyone in my house sees snow outside,627,futurama,https://i.redd.it/25dde5rir2wa1.gif,9
Oh you can't do this to us,1036,raimimemes,https://i.redd.it/h3vafoggy1wa1.jpg,40
Amber souvenir seller,3322,Catswithjobs,https://i.redd.it/ii0r7hv1m1wa1.jpg,52
Let's kill him (by kiwiis),1336,Deltarune,https://i.redd.it/rlq5yyny03wa1.png,13
My lava need me ,836,MyPeopleNeedMe,https://v.redd.it/6g1qwmyta2wa1,49
Will you be playing once it's released?,1434,HonkaiStarRail,https://i.redd.it/w2liimxdf1wa1.png,138
Starting a GameCube themed island,1131,ac_newhorizons,https://v.redd.it/vcmlme1q93wa1,50
This is why we can't have nice things,2540,Rabbits,https://www.reddit.com/gallery/12yfvyq,103
Who else has to wake up their doggo?,1213,pitbulls,https://v.redd.it/9ye8q9u9o1wa1,45
Overclocking in a next level,953,softwaregore,https://i.redd.it/ny6ltvd1l3wa1.jpg,13
The most dungeon feeling?,1938,PixelArt,https://i.redd.it/xf3wuxgsw0wa1.png,318
"Hi, I’m Bowie, and I just raced a greyhound, ate a big chunk of liver or something I found on the ground and tried to eat a bee",1094,Boxer,https://www.reddit.com/gallery/12ymlit,38
Wife and I are 9 months into a year-long backpacking trip. Ask us anything.,1545,travel,https://www.reddit.com/gallery/12yjmip,387
Tucker Carlson getting utterly wrecked in unaired interview,6757,antiwork,https://v.redd.it/pc4uyvwlq0wa1,216
How did this Pac-Man die?,1337,shittyaskscience,https://i.imgur.com/SP0HX8f.jpg,88
Restaurant owner prevents kidnapping attempt with a rear naked choke.,3190,nonononoyes,https://v.redd.it/pqkkpplk40wa1,195
Could you imagine belonging to a club like this?,1317,golf,https://v.redd.it/faa45kq6z2wa1,351
Art by Goro_Orb,1183,PERSoNA,https://i.redd.it/55d4i7bt53wa1.jpg,37
"Chad ""rescue a painter trapped in his own painting"" Oblivion vs virgin ""go to this cave and bring me this item"" Skyrim",1585,ElderScrolls,https://i.redd.it/f5laq8egp2wa1.jpg,194
If looks could kill,1928,thisismylifenow,https://v.redd.it/5bc84gdhv0wa1,26
Need help uwu,2792,mathmemes,https://i.redd.it/4l3cbh6sc0wa1.jpg,69
"Fellow [single] men, if a woman tells you that you seem to be emotionally unavailable, what do you do with that information?",1384,AskMen,https://www.reddit.com/r/AskMen/comments/12ykcbs/fellow_single_men_if_a_woman_tells_you_that_you/,1042
Ruining peoples live for petty reasons doesn't exactly make you a good person,1795,whenthe,https://v.redd.it/gv4qf9jez1wa1,69
"[Tennogen] ""Gauss Nitrolyst"" skin by me. Releasing tomorrow in-game with duviri.",1107,Warframe,https://steamcommunity.com/sharedfiles/filedetails/?id=2875301809,104
"Well, it now makes sense why I'm always extremely uncomfortable, everywhere, all the time.",53280,Wellthatsucks,https://i.redd.it/9xf02gs1f0wa1.jpg,2050
3.8 is the last Sumeru patch via Tao,1401,Genshin_Impact_Leaks,https://twitter.com/Plusle__Minun/status/1650836519735955458,560
Harry Belafonte Dead: Singer and Actor Was 96,2489,movies,https://variety.com/2023/music/news/harry-belafonte-dead-dies-singer-1235593910/,111
Dan and Cam are probably stoned at work today,1536,h3h3productions,https://www.reddit.com/r/h3h3productions/comments/12yjiqv/dan_and_cam_are_probably_stoned_at_work_today/,101
Chinese ‘police stations’ in the UK: Everything we know,1027,anime_titties,https://www.independent.co.uk/news/world/asia/chinese-police-stations-uk-where-b2323430.html?amp,179
"In case people forget, we live in capitalism",1425,destiny2,https://i.redd.it/0phjb6vyr3wa1.jpg,101
“ I’m skeptical right meow “,564,Thisismylifemeow,https://i.redd.it/vchhjwl0e4wa1.jpg,14
Exploring,3082,IllegallySmolCats,https://v.redd.it/x90k42vd21wa1,52
"W, Tap: Murder target union organizer",1298,magicthecirclejerking,https://i.redd.it/wn6gld03g1wa1.png,23
No more work,809,WorkersStrikeBack,https://i.redd.it/gbsxci5482wa1.jpg,11
My friend catching a huge fish in a tiny mountain stream yesterday!,2176,confusing_perspective,https://i.redd.it/xplkcd0n52wa1.jpg,22
Wondering why your tweets aren't getting attention even after paying $8 a month,742,SelfAwarewolves,https://i.redd.it/h97ru0d9f2wa1.jpg,40
British Challenger 2 tank at a training ground in Ukraine.,2119,TankPorn,https://i.redd.it/aa42ch1362wa1.jpg,86
Used Cars (1980) cast.,1568,OldSchoolCool,https://i.redd.it/wbpkeqkrk3wa1.jpg,164
First time out in front of people without a hat on. I was dreading this for the longest time but feeling a little more confident!,661,bald,https://www.reddit.com/gallery/12yqqbh,180
I was inspired so I drew Ryne~,1709,ffxiv,https://i.redd.it/ofl6w5ca01wa1.png,23
Photo of Destiny's next orbiter (she is interesting),1008,Destiny,https://i.redd.it/n5uwbswxs1wa1.png,73
"As big Rick and Morty fans, we wanted to test portals between physical and virtual reality and well, you know what the best portals are! This will be used within a mixed reality world Holonet. Your thoughts? :)",1614,rickandmorty,https://v.redd.it/fs1k0ofc31wa1,40
What did Yoda say when he first saw Star Wars in 1080p,1531,dadjokes,https://www.reddit.com/r/dadjokes/comments/12yj88l/what_did_yoda_say_when_he_first_saw_star_wars_in/,81
Does anyone have a tutorial/more photos of this or something similar?,1462,Minecraftbuilds,https://i.redd.it/1zqgcefdr2wa1.jpg,33
hmmm,8710,hmmm,https://i.redd.it/n7biighnb0wa1.jpg,149
the true ending,3698,PrequelMemes,https://i.redd.it/c5s4969dr1wa1.jpg,50
This one’s actually shitty,890,Shitty_Car_Mods,https://i.redd.it/viovwqruj3wa1.jpg,68
Fonetics,2265,SipsTea,https://i.redd.it/qo68daag03wa1.jpg,52
I wouldn’t hope it’s 10 Kevin outside..,2404,TheRealJoke,https://i.redd.it/8vyoee7vh0wa1.jpg,22
Here is everything we got in new content update!!!,626,FortNiteBR,https://i.redd.it/kd6q6xuh44wa1.jpg,96
Bruins fans sing “Livin’ On a Prayer” then get scored on,1079,nhl,https://v.redd.it/qkl0xz3v73wa1,114
Tyrion Lannister Drinking with the Witchers,1326,witcher,https://v.redd.it/ex7hf47ra1wa1,27
Lion El’Jonson vs Angron by Z-Bozi,1258,ImaginaryWarhammer,https://i.redd.it/s2hj5b0gy2wa1.jpg,26
"Costco Food Court Hiroshima, JPN",1189,Costco,https://i.imgur.com/0y2TspY.jpg,216
hmm,3640,hmm,https://i.redd.it/jrgz7kklf1wa1.jpg,108
My first time embroidering! (Bee nice 😉),1016,Embroidery,https://www.reddit.com/gallery/12ymoce,41
"Will Levis is currently +4000 to be the first overall pick. Well ladies and gentleman, he's telling friends and family Carolina will in fact take him on Thursday. You're welcome.",1841,sportsbook,https://www.reddit.com/r/sportsbook/comments/12yhjkq/will_levis_is_currently_4000_to_be_the_first/,1396
Google en pawssant,612,ActLikeYouBelong,https://i.redd.it/bgtxeguuh2wa1.jpg,14
Real,2635,doodoofard,https://v.redd.it/rlfzfv32u1wa1,42
Grandma thinks guys who change their underwear daily are effeminate.,1031,forwardsfromgrandma,https://i.redd.it/4ecb54fp93wa1.jpg,71
😳😳😳,5555,AnimalCrossing,https://i.redd.it/a8c8fu2lo1wa1.jpg,214
MozzarEcoli Sticks,2059,forbiddensnacks,https://i.imgur.com/bHnWAcT.jpg,16
Curry senpai,566,grandorder,https://i.redd.it/r64fwbvr84wa1.jpg,29
I can't Believe That These Peoples Are Actually Writers Of The Office !!,1330,DunderMifflin,https://i.redd.it/7bw8d3cbt3wa1.jpg,164
Waterbottles were used in the ancient times. Dated back into Roman era. Dont even think about it.,1260,dontputyourdickinthat,https://i.redd.it/99zbhtlix2wa1.jpg,45
"🔥 Xolo, an Aztec dog considered to guide men in Afterlife",18254,NatureIsFuckingLit,https://i.redd.it/jsdqtj523zva1.jpg,547
“I would rather stay sober than have to get sober all over again.”,1311,stopdrinking,https://www.reddit.com/r/stopdrinking/comments/12yk5vn/i_would_rather_stay_sober_than_have_to_get_sober/,129
"Cope, seethe, and maybe mald a bit of you’re feeling like it",1217,Ultrakill,https://i.redd.it/45ezmqdqz2wa1.jpg,88
Shreddin' through blizzards 📸 🏂,2121,analog,https://v.redd.it/ifjyptwlj0wa1,70
idk (yes),456,dogelore,https://www.reddit.com/gallery/12ytuk8,16
In case you ever feel useless:,1743,ForzaHorizon,https://i.redd.it/imwamtk5y0wa1.png,97
[Fairy Tail] has the best fan service,1420,animegifs,https://v.redd.it/x2ylg4ov81wa1,67
When does she appear? I am on episode 12 btw.,1573,evangelionmemes,https://i.redd.it/b7ll3iyc21wa1.jpg,98
"90% Contrast Paint Saurus Warrior, painted as everyone's favorite tyrant turtle.",815,ageofsigmar,https://ko-fi.com/Post/Painting-the-New-Saurus-Warriors--Tyrant-Dragon-T-O4O5KPH9E,38
why is she so casual about it,1731,IdiotsInCars,https://v.redd.it/upyjjsjlv1wa1,208
Kody Fae bathgate,2222,ScottishPeopleTwitter,https://i.redd.it/hckgbi1rz1wa1.jpg,63
I drew Bridget,1111,Guiltygear,https://www.reddit.com/gallery/12ylexx,50
Doing all I can to hold back these tears 😩,5177,BlackPeopleTwitter,https://i.redd.it/ebtdl9djn1wa1.jpg,220
What should i do for a 3 year anniversary?,596,projectzomboid,https://i.redd.it/11djdwtem2wa1.jpg,122
Very proud to be one of those 3.8 Million. #AMC #APE,699,amcstock,https://i.redd.it/d1a3rstqs2wa1.png,80
model pig,587,guineapigs,https://i.redd.it/o9to4gik44wa1.jpg,20
Puppies pick out their own collars,44607,aww,https://v.redd.it/t7kjem2l51wa1,355
[Film/TV] New official poster for 'The Flash',874,DCcomics,https://i.redd.it/9klc9d2802wa1.jpg,156
Ryan Gosling on playing Ken in Barbie,866,Fauxmoi,https://i.redd.it/2v02liygg4wa1.jpg,97
THE BIWEEKLY DEVIL IS BACK! EVERYONE PANIC,1046,Chainsawfolk,https://i.redd.it/hcg8wzcl63wa1.jpg,71
What a difference 28 years makes…,1658,BMW,https://www.reddit.com/gallery/12yi0wb,337
I rewatched meet the spy... And I had this little thought,5701,tf2,https://www.reddit.com/gallery/12yesb9,53
Adam Howden hoping we enjoy the DLC and shouting out those involved,910,Xenoblade_Chronicles,https://i.redd.it/xxrn7k52f3wa1.jpg,74
She coughed up a huge wad of mucus and everybody cheered.,1142,nursing,https://www.reddit.com/r/nursing/comments/12yl19b/she_coughed_up_a_huge_wad_of_mucus_and_everybody/,58
Never playing Goyo with randoms. This goober got me banned for a day,1533,Rainbow6,https://v.redd.it/wkbwgubl31wa1,108
Another one gone,5273,Steam,https://i.redd.it/thubp1697zva1.png,97
The first babies conceived with a sperm-injecting robot have been born,457,tech,https://www.technologyreview.com/2023/04/25/1071933/first-babies-conceived-sperm-injecting-robot-ivf-automation-icsi-overture/,78
Warrior,1885,AccidentalRenaissance,https://i.redd.it/fmmunkpeq0wa1.jpg,38
A flawless escape.,1605,OneSecondBeforeDisast,https://v.redd.it/rfbx71sp01wa1,21
"Soviet mosaic with bits of Ukrainian history in Tashkent, Uzbekistan // USSR // 1975",1794,PropagandaPosters,https://i.redd.it/j2fgwuj850wa1.png,97
Chadak,1241,IndianDankMemes,https://v.redd.it/1ddwkdqxf1wa1,253
I wanna hear that line,3443,Hololive,https://i.redd.it/ilnbxribs0wa1.jpg,12
We good?,1062,HighQualityGifs,https://i.redd.it/761fpu8qm1wa1.gif,142
I never quite grasped the frustration until I discovered that I had to resort to piracy just to play the Ubisoft Games I already owned on my Deck because UPlay kept crashing. What a hassle!,983,SteamDeck,https://i.imgur.com/VaUlvtE.jpg,112
(definetly very serious important discussion argument),430,tf2shitposterclub,https://i.redd.it/r5cglsl6o4wa1.png,49
"Breakfast on a balcony with views of Positano on the Amalfi Coast and the boats on the Gulf of Salerno, Campania, Italy.",3603,MostBeautiful,https://i.imgur.com/TfTHsxg.jpg,37
That is the reality of life. Adulthood sucks,1412,BikiniBottomTwitter,https://i.redd.it/vbtzzncbm3wa1.png,35
What take have you heard/read just screams “I’ve never taught before”?,1448,Teachers,https://www.reddit.com/r/Teachers/comments/12yiugx/what_take_have_you_heardread_just_screams_ive/,425
"oh you bought a 3? that's cool, which one?",992,DonutMedia,https://i.redd.it/132futrmp1wa1.png,59
Just hear me out...,2441,MadeMeSmile,https://v.redd.it/7iinp2pz62wa1,137
"All title cards, but they're in sync.",548,PizzaTower,https://v.redd.it/i7xdeunuo2wa1,33
"Shitposting daily so that other guy can't feel special, day 4",1586,Shark_Park,https://i.redd.it/2a9usjzuh2wa1.jpg,65
"All title cards, but they're in sync.",549,PizzaTower,https://v.redd.it/i7xdeunuo2wa1,33
I rewatched meet the spy... And I had this little thought,5703,tf2,https://www.reddit.com/gallery/12yesb9,53
Many Canadian politicians belong to the landlord class. We should question their motivations.,1459,onguardforthee,https://theprovince.com/opinion/columnists/douglas-todd-many-canadian-politicians-belong-to-the-landlord-class-we-should-question-their-motivations,104
Cat Chloe #969,1376,chloe,https://i.redd.it/3f2nsfty61wa1.jpg,29
I never quite grasped the frustration until I discovered that I had to resort to piracy just to play the Ubisoft Games I already owned on my Deck because UPlay kept crashing. What a hassle!,986,SteamDeck,https://i.imgur.com/VaUlvtE.jpg,112
I have no words Mr Wordington,540,wordington,https://i.redd.it/xes6xl4u74wa1.jpg,50
That is the reality of life. Adulthood sucks,1420,BikiniBottomTwitter,https://i.redd.it/vbtzzncbm3wa1.png,35
TV cameraman runs alongside rugby players,1098,PraiseTheCameraMan,https://v.redd.it/wi9tryn413wa1,16
Ganyu & Shenhe (by: Eternity),1201,Ganyu,https://i.redd.it/omu3egwle1wa1.jpg,23
(Eleanor and Jason high-five),774,TheGoodPlace,https://i.redd.it/mnxa2tsdl3wa1.png,10
"Fred Rogers performing a ""bedside solo show"" for 7-year old Beth Usher during her coma after undergoing surgery for ""Rasmussen’s encephalitis"" at the John Hopkins Childrens' Hospital in Baltimore, Maryland. February 1987 [720 x 478]",586,HistoryPorn,https://i.redd.it/39e2bh5il2wa1.jpg,38
We drove our Corgi through the middle of Australia and here are some of the photos ☺️,1620,corgi,https://www.reddit.com/gallery/12yhtkb,27
I wanna hear that line,3450,Hololive,https://i.redd.it/ilnbxribs0wa1.jpg,12
"You can't fool me, NutriBoom!",794,brooklynninenine,https://i.redd.it/i9nigunuj3wa1.jpg,36
Ah yes. The Dragon I wanted to customize: Me.,1256,wow,https://i.redd.it/pw1trovza1wa1.jpg,65
North America could use an International Funny Hat Day,618,simpsonsshitposting,https://i.redd.it/3jkqmhkqg2wa1.png,28
"City of Chicago forced to rehire, pay lost wages to workers fired for refusing COVID vaccine mandate",593,Conservative,https://www.theblaze.com/news/city-of-chicago-forced-to-rehire-pay-lost-wages-to-workers-fired-for-refusing-covid-vaccine-mandate,22
I was told you might like the mushroom hat I made,2032,goblincore,https://i.redd.it/ulqu314b12wa1.jpg,50
Had a dream Andrew Tate tweeted this,3749,thomastheplankengine,https://i.redd.it/bip8xrlb61wa1.jpg,39
“happy gene”🤨📸🏳️‍🌈,891,OkBuddyPersona,https://i.redd.it/d4rst8sxc3wa1.jpg,28
"Pregnancy endangering a woman's life is ""very rare""",2283,badwomensanatomy,https://www.reddit.com/r/badwomensanatomy/comments/12yfd6l/pregnancy_endangering_a_womans_life_is_very_rare/,398
Coming from a basic “alt” girl on TikTok,1096,Nicegirls,https://i.redd.it/wfnmojusi1wa1.jpg,64
"If BK, why 71% off exchange volume??? Wouldn’t it just die slowly 100% on exchange????",874,BBBY,https://i.redd.it/6thuyvu8o3wa1.jpg,91
"There's been some depressing shots/scenes in both shows, but this one left me feeling silently desolated",1277,betterCallSaul,https://i.redd.it/a2hmue0mr2wa1.png,99
Puppies pick out their own collars,44604,aww,https://v.redd.it/t7kjem2l51wa1,355
[OC]Custard and Marbled Chocolate Tart with a Cashew Nut Sable Crust,1886,FoodPorn,https://i.redd.it/lqj1pxoa52wa1.jpg,16
Confusing Somethings but he is right,5669,technicallythetruth,https://i.redd.it/5cvpax28q1wa1.jpg,39
